title,rating,offer_price,origional_price,url,description,des,dis2
Ontarious Look Men's Cotton Shirt  ₹499₹499 ₹999₹999 ,4.5 out of 5 stars,499,₹499₹999,https://www.amazon.in//Ontarious-Look-Digital-Printed-Stitched/dp/B091F9CNNV/ref=sr_1_19?dchild=1&keywords=shirts&qid=1619252548&s=computers&sr=1-19,"Crafted in a pure cotton fabric, this half-sleeved, regular-fit modern shirt offers superb comfort and an impeccable finish.  A reliable option for business wear, the shirt features a modern collar. Team with tailored trousers and blazer for a pared-back professional look. For that super smart weekend style, modern men can pick this casual shirt from Ontarious Look. Detailed with printed effect all over, this short-sleeved shirt is surely not to be missed out on. Made from cotton fabric, this shirt can be clubbed with denims and casual shoes. Look smart in casual/ formal/ partywear shirt from the house of Ontarious. The stylish look enhances the overall appreal of this shirt. This shirt ensures great comfort all day long. This shirt can be best teamed with a pair of trousers,jeans,chinos and lace-ups. Color and Sizes available. ",Date First Available:31 March 2021Manufacturer:Ontarious LookASIN:B091F9268NItem part number:OL_Shree_Shirt_Black_MDepartment:MenManufacturer:Ontarious LookNet Quantity:1.00 count,"Care Instructions: Machine WashFit Type: Regular FitMade of 100% Cotton, soft, comfy and breathable.Look trendy and feel comfortable with this Shirt.This Shirt will cater a rich in-class and genuine appearance in any kind of ambience and will comfort you with saving time.This Shirt is perfect for everyone like school-college student, working and sports person etc. and can be wear in workplaces, house or kitty parties, friendly outings, sports activities or even while travelling."
"Ramraj Men's Linen Unstitched 1.60 m Shirt Fabric (White, Free Size)  ₹464₹464 ₹555₹555 ",3.0 out of 5 stars,464,₹464₹555,https://www.amazon.in//Ramraj-Linen-Unstitched-Fabric-White_1-60/dp/B07CN7V1PB/ref=sr_1_20?dchild=1&keywords=shirts&qid=1619252548&s=computers&sr=1-20,It is white linen unstitched shirt fabric from the house of Ramraj. -1.60 metres.,Is Discontinued By Manufacturer:NoPackage Dimensions:27 x 18 x 2.1 cm; 350 GramsDate First Available:29 March 2018Manufacturer:RamrajASIN:B07CN7V1PBItem part number:Ramraj Unstitched ShirtDepartment:MenManufacturer:RamrajItem Weight:350 g,Fit Type: Regular FitMaterial : LinenSize : 1.60 metresBrand : Ramraj
"IndoPrimo Men's Regular Fit Casual Shirt  ₹699₹699 ₹1,999₹1,999 ",4.0 out of 5 stars,699,"₹699₹1,999",https://www.amazon.in//IndoPrimo-Cotton-Casual-Shirt-Sleeves/dp/B08JHT17CV/ref=sr_1_21?dchild=1&keywords=shirts&qid=1619252548&s=computers&sr=1-21,,Is Discontinued By Manufacturer:NoDate First Available:31 August 2018Manufacturer:IndoPrimoASIN:B08KQ2Y4NHItem part number:Latest Men's Casual Shirt 1Department:MenManufacturer:IndoPrimo,"Care Instructions: First Time Dry-Clean followed by hand washFit Type: Regular Fit100% High-grade Cotton Fabrics: Good capability of tenderness, air permeability and moisture absorption feels soft and comfy.Suitable for: Sports, Casual, Business Work, Date, Party, Perfect gift for families, friends and boyfriendSlim Fit , Fabric: 100% Cotton , Full Sleeve ,Casual ShirtsHigh Quality Fabric and StitchingWash Instruction: Machine/Hand-wash in cold water , Low iron and tumble dry on low heat"
"First Kids Step FARETO Unisex Baby Clothing Set/6 Front Open Shirts/6 Single Layer Nappies/6 Caps, 0-3 Months (Assorted)(L-10 Inchs, B-9Inchs)  ",3.8 out of 5 stars,599,"₹599₹1,299",https://www.amazon.in//gp/bestsellers/apparel/1953175031/ref=sr_bs_21_1953175031_1,,,
"EYEBOGLER Regular Men's Cotton Designer T-Shirt (EB1T67)  ₹377₹377 ₹1,299₹1,299 ",3.2 out of 5 stars,377,"₹377₹1,299",https://www.amazon.in//EYEBOGLER-Regular-Red-White-Designer-XXL-EB1T67-WRWH_XX-Large/dp/B089B48TZ1/ref=sr_1_23?dchild=1&keywords=shirts&qid=1619252548&s=computers&sr=1-23,,"Product Dimensions:66 x 44 x 1 cm; 240 GramsDate First Available:28 May 2020Manufacturer:Seven Rocks International, Cheema Chowk, Ludhiana.ASIN:B089B3FZKZItem model number:T67Department:MenManufacturer:Seven Rocks International, Cheema Chowk, Ludhiana., Seven Rocks International, Cheema Chowk, Ludhiana.Item Weight:240 gItem Dimensions LxWxH:66 x 44 x 1 CentimetersGeneric Name:T-Shirt","Care Instructions: Machine WashFit Type: regular fitUnique Design with Excellent durable fabricSoft flow dyed 60% Cotton, 40% Polyester FabricFabric GSM is 180Machine wash ColdRegular Fit and dimensionally accurate size"
Peter England Men's Regular Fit Shirt  ,4.1 out of 5 stars,549,₹549₹999,https://www.amazon.in//Peter-England-Printed-Regular-PESFONUP136900_Pink/dp/B08T1WB1C2/ref=sr_1_24?dchild=1&keywords=shirts&qid=1619252548&s=computers&sr=1-24,"Peter England Printed Pink Long Sleeve Shirt. Peter England was founded in 1889, Londonderry, Ireland to provide British soldiers with fine Khaki trousers during the Boer War. More than a century later, Peter England made its foray into the Indian market in 1997.","Product Dimensions:26 x 21 x 2 cm; 300 GramsDate First Available:14 January 2021Manufacturer:ABFRLASIN:B08T1WB1C2Item model number:PESFONUP136900Department:MenManufacturer:ABFRL, Aditya Birla Fashion and Retail Ltd,7th Floor, Skyline Icon Business Park, 86-92, Off A.K. Road, Marol Village, Andheri (East), Mumbai, Maharashtra 400059Item Weight:300 gItem Dimensions LxWxH:26 x 21 x 2 CentimetersGeneric Name:Shirt",Care Instructions: Machine WashFit Type: Regular FitPeter England Printed Pink ShirtFit type: Regular FitSpecial size type: Standarditem weight: 300.0 grams
,,,,https://www.amazon.in/#s-skipLinkTargetForMainSearchResults,,,
