title,rating,offer_price,origional_price,url,description,des,dis2
"Tryme Fashion Men's Regular Fit Casual Shirt  ₹699₹699 ₹1,999₹1,999 ",3.9 out of 5 stars,699,"₹699₹1,999",https://www.amazon.in//Tryme-Fashion-Cotton-Checked-Sleeves/dp/B08LH1SKFD/ref=sr_1_1?dchild=1&keywords=shirts&qid=1619252548&s=computers&sr=1-1,"Shop from a wide range of Shirt from Tryme Fashion. Perfect for your everyday use, you could pair it with a stylish pair of Jeans or Trousers complete the look.",Is Discontinued By Manufacturer:NoPackage Dimensions:26.8 x 23.8 x 6.1 cm; 290 GramsDate First Available:24 October 2018Manufacturer:TRYme FashionASIN:B0848RMQ69Item part number:Men's Casual Shirt ChecksDepartment:MenManufacturer:TRYme FashionItem Weight:290 g,Care Instructions: Dry Clean OnlyFit Type: Regular FitFabric: CottonStyle: RegularPattern: SolidSleeve Type: Full Sleeve
Amazon Brand - Symbol Men's Regular Fit Casual Shirt  ,4.0 out of 5 stars,689,"₹689₹1,899",https://www.amazon.in//Amazon-Brand-Checkered-Regular-AZ-SY-RR01_9322_Red-Black_Large/dp/B07QGK8PD2/ref=sr_1_2?dchild=1&keywords=shirts&qid=1619252548&s=computers&sr=1-2,"An Amazon brand, Symbol is built on the pillars of quality, reliability and affordability, offering a range of lifestyle essentials that help you look good every day. Symbol brings a range of classic casual shirts in a variety of colors that keep you subtle & comfortable. Built for comfort, our essential pair of casual shirts find place in every man’s wardrobe. This Regular fit 100% cotton check shirt is designed in regular collar with single chest pocket. Roll up sleeves with tab make this classic combination of Red Navy checks a must have. Wear this shirt with a pair of denims with white sneakers for a versatile casual look.",Package Dimensions:36.8 x 24.3 x 4 cm; 290 GramsDate First Available:18 November 2019Manufacturer:Amazon Brand - SymbolASIN:B081NKRNXJItem model number:AZ-SY-RR03_7906Department:MenManufacturer:Amazon Brand - SymbolItem Weight:290 gGeneric Name:Casual Shirt,Care Instructions: Machine WashFit Type: Regular FitMaterial - 100% CottonRegular fit and Full sleeve shirtCollar style - Classic collar; Cuff style - Single cuffPattern - Checkered Men’s Casual ShirtDry dark colors under shade
"Diverse Men's Regular Formal Shirt  ₹459₹459 ₹1,199₹1,199 ",4.0 out of 5 stars,459,"₹459₹1,199",https://www.amazon.in//Diverse-Printed-Regular-Cotton-DVF01F2L01-263-40_Navy_40/dp/B075KK8SZ4/ref=sr_1_3?dchild=1&keywords=shirts&qid=1619252548&s=computers&sr=1-3,"Diverse is a western wear value brand for men. Our range consists of basic and updated basic apparel across both formal and casual wear. We offer the right blend of quality, style and value aimed to delight our customers.","Package Dimensions:22.6 x 21.8 x 5.4 cm; 360 GramsDate First Available:7 April 2020Manufacturer:SHAKTI BRANDZASIN:B075KK8SZ4Item model number:DVF01F2L01-263Department:MenManufacturer:SHAKTI BRANDZ, SHAKTI BRANDZItem Weight:360 gNet Quantity:1 NGeneric Name:Formal Shirt",Fit Type: RegularRegular fit and Full sleeve shirtPattern - Printed Men’s Formal ShirtDouble yoke for extra durability & stiffness; Patch pocket at chestMachine washMade in IndiaMaterial: 100% Cotton
"Sitafal Trendz Mens Shirts Mens Half Sleeve Shirts - Men's Summer Shirt Rayon Cotton Lining Digital Printed Stitched Half Sleeve Shirt  ₹649₹649 ₹1,449₹1,449 ",,649,"₹649₹1,449",https://www.amazon.in//Sitafal-Trendz-Mens-Shirts-Sleeve/dp/B092J1G2BR/ref=sr_1_4?dchild=1&keywords=shirts&qid=1619252548&s=computers&sr=1-4,"We Launch exclusive new range of high quality printed casual shirt for mans under range; This printed casual shirt has slim collar; a full button placket; long sleeves; and a curved hemline; the product made out of best quality Rayon. It designed for comfort and style; it can be worn to parties; casual meetings or a movie date. Make it up with a pair of denims; chinos; shorts or formal trousers and set the town on fire with your Style. 100% Washable Digital Printed Shirts Fabric White Hand-wash, MACHINE WASH DIGITAL PRINTED SHIRTS. This shirt made of premium quality material. Searching for casual shirts for this summer or festive? Then this smart shirt, Digital Printed Sanskar Fashion shirt from the house of Sanskar Fashion Garments are here to end your search. This amazing printed shirt will make you fall in love with the attractive colour. It's very cool on skin. Quality 100% premium fabric is really different from others. Design The shirt features a half sleeve and a Regular collar design which gives the shirt a stylish look and feel. For any of your casual evenings this shirt can be your option to wear.",Date First Available:8 April 2021ASIN:B092HT3LKGItem part number:WOOLFDepartment:MenNet Quantity:1.00 count,Care Instructions: Dry Clean OnlyFit Type: Regular FitCare Instructions: Hand Wash OnlyFit Type: WesternPLEASE CHECK THE SIZE BEFORE ORDER - MEASURE WITH YOUR BODY SIZECare Instructions: Hand Wash Only Fit Type: Regular Fit : Breathable : truly comfortable and easy to wear in every season it is insulating in winter and breathable in summerStylish Half sleeve casual Printed Shirts & Party Wear Casual shirtsPattern: Digital Printed Cotton Shirts & Party Wear Printed Cotton Shirts. Stylish Printed Casual Shirt
GRITSTONES Men's Regular Fit Shirt  ,3.7 out of 5 stars,378,"₹378₹1,199",https://www.amazon.in//GRITSTONES-Cotton-Sleeves-Chinese-Collar/dp/B07N1NRY5V/ref=sr_1_5?dchild=1&keywords=shirts&qid=1619252548&s=computers&sr=1-5,,Is Discontinued By Manufacturer:NoProduct Dimensions:38 x 28 x 2 cm; 250 GramsDate First Available:22 January 2019Manufacturer:GRITSTONESASIN:B07N1MWH2KItem part number:GSFSSHRT1643ANTRA-SDepartment:MenManufacturer:GRITSTONESItem Weight:250 gItem Dimensions LxWxH:38 x 28 x 2 Centimeters,Care Instructions: Machine WashFit Type: Regular FitFabric: CottonStyle: RegularNeck Style: CollaredPattern: SolidSleeve Type: Full Sleeve
Dennis Lingo Men's Solid Slim Fit Casual Shirt  ,3.8 out of 5 stars,549,"₹549₹1,849",https://www.amazon.in//Dennis-Lingo-Casual-C301_SkyBlue_L_Sky-Blue_L/dp/B079S5GVRK/ref=sr_1_6?dchild=1&keywords=shirts&qid=1619252548&s=computers&sr=1-6,"Product Details:This Casual Solid shirt has a Mandarin / Chinese collar, full button Placket, Long Sleeves, and a curved hemlineSize and FitSlim FitThe Model (height 6 foot and shoulders 18 inches is wearing size 40/MPlease check the size chart for more details before orderingMaterial & Care100% Premium Cotton (Machine Wash Regular)Style TipEnhance your look by wearing this Casual Stylish Men's shirt. Team it with a pair of Chinos and white sneakers for a fun Smart Casual lookAbout the Brand DENNIS LINGOFinding Basic Menswear for daily use can be hard among todays Fast fashion world, where trends change daily. That’s why we started Dennis Lingo, to create a one stop shop for premium essential clothing for everyday use at lowest prices","Product Dimensions:30 x 24 x 1 cm; 200 GramsDate First Available:2 August 2019Manufacturer:Swastik CreationASIN:B07W2YBGJ3Item model number:C301_B-GREEN_SDepartment:MenManufacturer:Swastik Creation, Swastik Creation -B-21, Bharat Ind. Estate, Sewree (w) ,Mumbai-15, Email - dennislingoshirts@gmail.com, Phone No. 022-22010742Packer:Swastik Creation -B-21, Bharat Ind. Estate, Sewree (w) ,Mumbai-15, Email - dennislingoshirts@gmail.com, Phone No. 022-22010742Item Weight:200 gItem Dimensions LxWxH:30 x 24 x 1 CentimetersNet Quantity:1 NumbersIncluded Components:Casual ShirtGeneric Name:Casual Shirt",Care Instructions: Machine WashFit Type: Slim FitColor Name: Bottle Green100% CottonLong sleeveSlim fitMachine wash
Dennis Lingo Men's Solid Slim Fit Casual Shirt  ,3.9 out of 5 stars,549,"₹549₹1,849",https://www.amazon.in//Dennis-Lingo-Solid-Casual-CC201_Dustypink_M_Dustypink_M/dp/B07HK6NT81/ref=sr_1_7?dchild=1&keywords=shirts&qid=1619252548&s=computers&sr=1-7,"Product Details:This Casual Solid shirt has a Mandarin / Chinese collar, full button Placket, Long Sleeves, and a curved hemlineSize and FitSlim FitThe Model (height 6 foot and shoulders 18 inches is wearing size 40/MPlease check the size chart for more details before orderingMaterial & Care100% Premium Cotton (Machine Wash Regular)Style TipEnhance your look by wearing this Casual Stylish Men's shirt. Team it with a pair of Chinos and white sneakers for a fun Smart Casual lookAbout the Brand DENNIS LINGOFinding Basic Menswear for daily use can be hard among todays Fast fashion world, where trends change daily. That’s why we started Dennis Lingo, to create a one stop shop for premium essential clothing for everyday use at lowest prices","Product Dimensions:30 x 24 x 1 cm; 220 GramsDate First Available:19 March 2021Manufacturer:Swastik Creation -Gala no.B-21,Bharat Industrial estate, T.J. Road, Sewree (w) ,Mumbai - 400050ASIN:B08ZKSLNQ1Item model number:AZ201_B-GREEN_SDepartment:MenManufacturer:Swastik Creation -Gala no.B-21,Bharat Industrial estate, T.J. Road, Sewree (w) ,Mumbai - 400050, Swastik Creation -Gala no.B-21,Bharat Industrial estate, T.J. Road, Sewree (w) ,Mumbai - 400032Packer:Swastik Creation -Gala no.B-21,Bharat Industrial estate, T.J. Road, Sewree (w) ,Mumbai - 400015Item Weight:220 gItem Dimensions LxWxH:30 x 24 x 1 CentimetersNet Quantity:1.00 countGeneric Name:Shirt","Care Instructions: Machine WashFit Type: Slim FitFabric - 100% Premium Cotton, Pre-Washed for extremely soft finish and Guaranteed 0% Shrinkage Post WashingStyle - Enhance your look by wearing this Casual Stylish Men's shirt, Team it with a pair of tapered denimsOr Solid Chinos and Loafers for a fun Smart Casual lookFit Type - Size chart - S-38, M-40, L-42, XL-44, XXL-46. Please Check the Size chart before Ordering for the Perfect FitAbout the Brand DENNIS LINGO - Finding Basic Menswear for daily use can be hard among todays Over priced Fast fashion world, where trends change daily. That’s why we started Dennis Lingo, to create a one stop shop for premium essential clothing for everyday use at lowest prices and bring Basics back in trend."
SIFOJON Men's Cotton Lining Digital Printed Shirt Fabric (Free Size) Bye 2 get 1 free  ,3.3 out of 5 stars,499,"₹499₹1,599",https://www.amazon.in//SIFOJON-Cotton-Lining-Digital-Printed/dp/B08KY8Y5XM/ref=sr_1_8?dchild=1&keywords=shirts&qid=1619252548&s=computers&sr=1-8,Latest Design Like Eiffel Tower Men Cotton unstitched Fabrics Shirts-White Shirt 2.5 miter cotton fabrics and packing is good and so fast delivered your home.,Date First Available:2 October 2020Manufacturer:SIFOJONASIN:B08KY8Y5XMItem part number:SIFO879JON78RCountry of Origin:IndiaManufacturer:SIFOJONNet Quantity:2.5 metre,size:2.5 miterMaterial - CottonPattern - Eiffel Towerbrand : SIFOJ0N
Amazon Brand - Symbol Men Formal Shirt  ,3.8 out of 5 stars,368,"₹368₹1,299",https://www.amazon.in//Amazon-Brand-Symbol-Regular-SS20SYMFS01_WhtDobB_White5/dp/B082SRT2F3/ref=sr_1_9?dchild=1&keywords=shirts&qid=1619252548&s=computers&sr=1-9,Elevate your look with symbol formal shirts for a timeless and sophisticated sense of style that leaves a lasting impression. Symbol formal shirts are crafted with precision to offer enhanced comfort and style at an affordable price. This classic shirt gives you a clean and classy look while also making you feel comfortable. Create a lasting impression by pairing it with an elegant solid color chino pants or trousers and leather shoes.,Package Dimensions:24.1 x 20.1 x 6.8 cm; 210 GramsDate First Available:16 December 2019Manufacturer:Amazon Brand - SymbolASIN:B082SRNR7FItem model number:SS20SYMFS01_WhtDobBDepartment:MenManufacturer:Amazon Brand - SymbolItem Weight:210 gGeneric Name:Formal Shirt,Care Instructions: Machine WashFit Type: Regular Fit58% Polyester 42% cottonSemi cut-away collarRegular fit shirt with classic cut away collar and chiselled cuffDobby fabric - This shirt is made from self-design fabricBest paired with formal trousers or semi formal chinosMade in India
The Indian Garage Co Men's Slim Fit Shirt  ,3.7 out of 5 stars,728,"₹728₹1,749",https://www.amazon.in//Indian-Garage-Co-Shirt-1119-SH25-10/dp/B087S5BL65/ref=sr_1_10?dchild=1&keywords=shirts&qid=1619252548&s=computers&sr=1-10,The Indian Garage Co Grey Slim Fit Checked Shirts,Product Dimensions:32 x 27 x 2.5 cm; 500 GramsDate First Available:28 April 2020Manufacturer:The Indian Garage CoASIN:B087S5BL65Item model number:1119-SH25-10-GreyDepartment:MenManufacturer:The Indian Garage CoItem Weight:500 gItem Dimensions LxWxH:32 x 27 x 2.5 CentimetersGeneric Name:Shirt,Care Instructions: Machine WashFit Type: Slim FitColor name: GreyMaterial: CottonLong SleevesMachine Wash
"Allen Solly Men's Plain Slim Fit Casual Shirt  ₹749₹749 ₹1,399₹1,399 ",3.6 out of 5 stars,749,"₹749₹1,399",https://www.amazon.in//gp/bestsellers/apparel/1968094031/ref=sr_bs_10_1968094031_1,,,
"Raymond Mens Combo Set Unstitched Shirt 2.25 Meters and Trouser Fabric 1.2 Meters - Gift Box Packing - F13  ₹999₹999 ₹1,499₹1,499 ",5.0 out of 5 stars,999,"₹999₹1,499",https://www.amazon.in//Raymond-Unstitched-Meters-Trouser-Fabric/dp/B08QX9YZTM/ref=sr_1_12?dchild=1&keywords=shirts&qid=1619252548&s=computers&sr=1-12,Raymond Shirt and Trouser Combo. FilaFil Self Design Shirt and Solid Black Trouser. 2.25 mt Shirt Fabric and 1.2 mt Trouser Fabric. Gift Box Packing as shown in Image,Is Discontinued By Manufacturer:NoProduct Dimensions:15 x 12 x 8 cm; 450 GramsDate First Available:16 December 2020Manufacturer:RaymondASIN:B08QX9YZTMItem part number:RYMD_FILAFIL_COMBO_13Country of Origin:IndiaManufacturer:RaymondItem Weight:450 gItem Dimensions LxWxH:15 x 12 x 8 CentimetersNet Quantity:1.00 PackGeneric Name:Shirt and Trouser Fabric Combo Set with Gift Box,"Raymond Pre-matched shirt and trouser Fabric. Same Color as shown in ImageIdeal For Personal use as well as Gifting in Marriage, Festival and other Ocassions. Perfect for Special Occasions, Formal or Semi-Casual look.Cotton Polyster Blended Shirt Fabric - 2.25 M . Soft and Comfortable Polyblended Trouser Fabric (1.20 M)Fabric Care: Gentle machine wash, Do not bleach, Dry in shade, Medium to Hot Iron.Ideal for Gifting in Birthdays, Marriage, Anniversary, Diwali, Pongal, Ugadi, Eid, Graduation Gift, For Son, Father, Brother, Groom , Father in Law, Friends"
"Van Heusen Sport Men's Checkered Slim fit Formal Shirt  ₹809₹809 ₹1,499₹1,499 ",4.1 out of 5 stars,809,"₹809₹1,499",https://www.amazon.in//Van-Heusen-Sport-Checkered-VHSFBSLPW13637_Blue/dp/B07K3FKCGL/ref=sr_1_13?dchild=1&keywords=shirts&qid=1619252548&s=computers&sr=1-13,"Van Heusen shirts offers an array of products perfect for any occasions. Upgrade your wardrobe with this white check shirt, tailored in Slim Fit by Van Heusen.",Package Dimensions:34 x 22.4 x 2.4 cm; 260 GramsDate First Available:1 November 2018Manufacturer:Van Heusen SportASIN:B07K3P9FPPItem model number:VHSFBSLPW13637Department:MenManufacturer:Van Heusen SportItem Weight:260 gGeneric Name:Formal Shirt,Care Instructions: Machine WashFit Type: slim fitColour: Blue With WhiteMaterial: cottonSlim fitLong sleeveMachine wash
IndoPrimo Men's Slim Fit Casual Shirt  ,3.9 out of 5 stars,699,"₹699₹1,999",https://www.amazon.in//IndoPrimo-Cotton-Casual-Stylish-Sleeve/dp/B08R21T75D/ref=sr_1_14?dchild=1&keywords=shirts&qid=1619252548&s=computers&sr=1-14,"Shop from a wide range of Casual Shirt from IndoPrimo . Perfect for your everyday use, you could pair it with a stylish pair of Jeans or Trousers complete the look.",Is Discontinued By Manufacturer:NoPackage Dimensions:14 x 14 x 4 cm; 300 GramsDate First Available:31 August 2018Manufacturer:IndoPrimoASIN:B08R21DKPCItem part number:Men's Stylish Casual Shirt LizaDepartment:MenManufacturer:IndoPrimoItem Weight:300 gNet Quantity:1.00 Unit,"Care Instructions: Hand Wash OnlyFit Type: Regular Fit100% High-grade Cotton Fabrics: Good capability of tenderness, air permeability and moisture absorption feels soft and comfy.Suitable for: Sports, Casual, Business Work, Date, Party, Perfect gift for families, friends and boyfriendSlim Fit , Fabric: 100% Cotton , Full Sleeve ,Casual ShirtsHigh Quality Fabric and StitchingWash Instruction: Handwash / Machine wash| Low iron and tumble dry on low heat"
"VIBRAT Unisex Shirt Tucker Stays Lock Belt Strap Adjustable Elastic Wrinkle-Free Non-Garters Stay Clamps holder Keeps (Black, Large)  ",4.2 out of 5 stars,379,"₹379₹1,199",https://www.amazon.in//VIBRAT-Adjustable-Elastic-Holder-Military/dp/B082WXRCHD/ref=sr_1_15?dchild=1&keywords=shirts&qid=1619252548&s=computers&sr=1-15,,Package Dimensions:16.4 x 6.1 x 2.6 cm; 50 GramsDate First Available:18 December 2019ASIN:B082WXRCHDItem part number:shirt_stay_beltCountry of Origin:IndiaDepartment:UnisexItem Weight:50 g,"High Quality Material: The belt-style shirt stay is made of hook and loop material with 10x the tensile strength of velcro, uses a revolutionary design and functionality in order to enhance your aesthetic and professional appearanceEasy to Use: The belt-style shirt stay is the easiest shirt stay you'll ever use, and takes only a few seconds to put on each morning.The rubber grips and a button slot guarantee your shirt to stay tucked, keeping it low and close to the body.You'll quickly forget you are even wearing itShirt Stays Sizeï¼?2.50CMx120CM( 1inch x 47.2inch) Adjustable, Maximum stretch 150cm or 59in. One size fit all most!"
"Purabelle Unisex Shirt Tucker Stays Lock Belt Strap Adjustable Elastic Wrinkle-Free Non-Garters Stay Clamps holder Keeps (Black,Free Size)  ",3.6 out of 5 stars,349,₹349₹499,https://www.amazon.in//Purabelle-Adjustable-Elastic-Wrinkle-Free-Non-Garters/dp/B08WLVZ2FH/ref=sr_1_16?dchild=1&keywords=shirts&qid=1619252548&s=computers&sr=1-16,"Purabelle Adjustable | Non-Slip | Locking Clamps |Invisible Elastic Shirt Stays Tucker Garter Belt for Men And Women (Black)  No one likes a half-undone shirt, it looks sloppy and unprofessional, and constantly tucking it back in is even more embarrassing. It uses a revolutionary design and functionality in order to enhance your aesthetic and professional appearance. Comfortable enough for daily wear. You know the classic saying: You never get a second chance to make a first impression. Our Shirt Stays -Belt Style widely used for Military，Police，Lawyer，Business person， Waiter and so on. Fit for men and women waist!!    Features:  It is designed to keep your shirt tucked in to be worn daily and withstand washing. The shirt stays are made with a durable elastic strap, an adjustable buckle, and metal clip with nylon teeth. The adjustable buckle ensures that once adjusted it will not readjust. The metal clip firmly grips on to your shirt and socks to keep your shirt tucked in and looking good. Metal clasps with nylon teeth firmly grip your shirts all day without damaging them.  HOW TO USE?: Step 1: Slide last shirt button into the metal clip. Step 2:Wrap tucker around waist and fasten， adjust the size to fit accordingly. Step 3:Put on your pants, keeps your body a more slim appearance.  ",Package Dimensions:17 x 10 x 6 cm; 200 GramsDate First Available:15 February 2021Manufacturer:PurabelleASIN:B08WLVZ2FHItem part number:PB-STB01Country of Origin:IndiaManufacturer:PurabelleItem Weight:200 gNet Quantity:1.00 countGeneric Name:Shirt Tucker,"The adjustable shirt holders are suitable for people usually need to wear shirt, both men and women, or for people have to interview, give a speech, go to the wedding, work, attend official occasions, and so onThe shirt lock belt is easy to use, the buckle slot is convenient for you to tie the belt, can keep the shirt tucked in tightly, keep it flat and neat, make you look charmingThe elastic shirt belts are made of spandex and the hook is made of nylon, durable to use, they are elastic, will not make your shirt slip out, lightweight to wear, will not give you burden, can resist to sweat, abrasion, meet your need in neat appearanceYou will get 1 pieces shirt stay lock belts, enough quantity for you to wear for daily life, suitable for your various shirtsCare Instructions: Dry Clean Only"
Vida Loca Cotton Men's Casual Shirt  ,3.5 out of 5 stars,586,"₹586₹2,499",https://www.amazon.in//Vida-Loca-Cotton-Casual-Shirt/dp/B08LBPCXN3/ref=sr_1_17?dchild=1&keywords=shirts&qid=1619252548&s=computers&sr=1-17,"Vida Loca this trendy and attractive Shirt that comes in a solid pattern. It has a pleated design that enhances your look. This shirt can be paired with jeans of your choice to create a fashionable and enticing look. We are here to make your style rule in the minds of people, Ultimate street fashion meticulously crafted with 100% cotton fabric.   The cozy style will be a perfect addition to your fashion apparel. Pair it with Tracks, Chinos or Jeans for an urban look, Grab the Vida Loca collection for your stylish collection for your wardrobe.   If you're looking to add a few fine Shirts to your wardrobe, Vida Loca is perfect for you. It’s ideal for guys who treat this noble garment not as a layer, but as the grace note to the ensemble. Skillfully crafted from top-grade fabric, these Shirts are amazing slip-one for you.   1.This design gives a brand new spin to your look and makes all heads turn in your direction in praise of your tasteful choice.   2.This Shirt is made of good quality cotton fabric which has a gentle touch on the skin and has a crinkly surface.   3.A Winter Shirt like this one is bound to bring out the feminine side in you and make you look oh so pretty!.   4.It will surely complement your style statement. don't think twice before getting this classic style.   5.This attractive pattern enhances the look of your overall outfit and elevates your fashion statement.   6. Wash Care Instructions: Wash separately in cold water, do not bleach.",Date First Available:15 October 2020Manufacturer:Acchajee Online Shopping Pvt.LtdASIN:B08VN8KSC7Item part number:VLMSC-0256Department:MenManufacturer:Acchajee Online Shopping Pvt.LtdNet Quantity:1.00 Unit,"Care Instructions: Machine WashFit Type: Slim FitFit Type: Classic FitMade of 100% Cotton, soft, comfy and breathable.Look trendy and feel comfortable with this Full Sleeve Shirt.This casual Shirt is perfect for everyone like school-college student, working and sports person etc. and can be wear in workplaces, house or kitty parties, friendly outings, sports activities or even while travelling.Care Instructions: Machine Wash"
"Sanskar Fashion Mens' Shirts, Digital Printed Half Sleeves Shirts for Men, Rayon Cotton (XXL-46, Multi-Square)  ",2.1 out of 5 stars,519,₹519₹999,https://www.amazon.in//Sanskar-Fashion-Mens-Digital-Multi-Square/dp/B08YNL1TBZ/ref=sr_1_18?dchild=1&keywords=shirts&qid=1619252548&s=computers&sr=1-18,"This shirt made of premium quality material. Searching for casual shirts for this summer or festive? Then this smart shirt, Digital Printed Sanskar Fashion shirt from the house of Sanskar Fashion Garments are here to end your search. This amazing printed shirt will make you fall in love with the attractive colour. It's very cool on skin. Quality 100% premium fabric is really different from others.Set new trends this season with this smart shirt. Team it with a pair of chinos, jeans or trousers and black or brown shoes for a smart casual look and with a pair of white sneakers for a fun smart casual look. Product Details: This casual or formal printed stylish shirt has a collar, a full button Placket. Sizes: 40 M 42 L 44 XL 46 XXL.About the Brand Sanskar Fashion: Finding Basic Menswear for daily use can be hard among today's Fast fashion world, where trends change daily. That's why we started Sanskar Fashion Garments, to create a one stop shop for premium essential clothing for everyday use at rock bottom prices.",Product Dimensions:5 x 15 x 20 cmDate First Available:20 February 2021Manufacturer:Sanskar FashionASIN:B08YNL1TBZItem model number:Mens ShirtCountry of Origin:IndiaDepartment:MenManufacturer:Sanskar FashionItem Dimensions LxWxH:50 x 150 x 200 MillimetersNet Quantity:1.00 count,"Care Instructions: First Time Dry-Clean followed by hand washFit Type: Straight FitPackage Contains: 1 Men's ShirtFabric: Rayon Cotton, Printing: Digital PrintedNeck Type: Collar NeckSleeves: Half SleevesTry wearing matching sneakers with this shirt whenever you head out."
