title,rating,offer_price,origional_price,url,description,des,dis2
Diverse Men's Regular Formal Shirt  ,4.0 out of 5 stars,409,"₹409₹1,199",https://www.amazon.in//gp/bestsellers/apparel/1968096031/ref=sr_bs_0_1968096031_1,,,
"Tryme Fashion Men's Regular Fit Casual Shirt  ₹699₹699 ₹1,999₹1,999 ",3.9 out of 5 stars,699,"₹699₹1,999",https://www.amazon.in//Tryme-Fashion-Cotton-Checked-Sleeves/dp/B08LH1SKFD/ref=sr_1_2?dchild=1&keywords=shirts&qid=1620052587&s=computers&sr=1-2,"Shop from a wide range of Shirt from Tryme Fashion. Perfect for your everyday use, you could pair it with a stylish pair of Jeans or Trousers complete the look.",Is Discontinued By Manufacturer:NoPackage Dimensions:26.8 x 23.8 x 6.1 cm; 290 GramsDate First Available:24 October 2018Manufacturer:TRYme FashionASIN:B0848RMQ69Item part number:Men's Casual Shirt ChecksDepartment:MenManufacturer:TRYme FashionItem Weight:290 g,Care Instructions: Dry Clean OnlyFit Type: Regular FitWash Care: Dry Clean OnlyFabric Type: CottonPattern name: SolidClosure Type: ButtonedSleeve Type: Long Sleeve; Collar Style: Classic
Ontarious Look Men's Cotton Digital Printed Half Sleeves Shirt  ₹499₹499 ₹999₹999 ,4.6 out of 5 stars,499,₹499₹999,https://www.amazon.in//Ontarious-Look-Digital-Printed-Sleeves/dp/B091F9CNNV/ref=sr_1_3?dchild=1&keywords=shirts&qid=1620052587&s=computers&sr=1-3,"Crafted in a pure cotton fabric, this half-sleeved, regular-fit modern shirt offers superb comfort and an impeccable finish.  A reliable option for business wear, the shirt features a modern collar. Team with tailored trousers and blazer for a pared-back professional look. For that super smart weekend style, modern men can pick this casual shirt from Ontarious Look. Detailed with printed effect all over, this short-sleeved shirt is surely not to be missed out on. Made from cotton fabric, this shirt can be clubbed with denims and casual shoes. Look smart in casual/ formal/ partywear shirt from the house of Ontarious. The stylish look enhances the overall appreal of this shirt. This shirt ensures great comfort all day long. This shirt can be best teamed with a pair of trousers,jeans,chinos and lace-ups. Color and Sizes available. ",Date First Available:31 March 2021Manufacturer:Ontarious LookASIN:B091F9268NItem part number:OL_Shree_Shirt_Black_MDepartment:MenManufacturer:Ontarious LookNet Quantity:1.00 count,"Care Instructions: Machine WashFit Type: RegularMade of 100% Cotton, soft, comfy and breathable.Look trendy and feel comfortable with this Shirt.This Shirt will cater a rich in-class and genuine appearance in any kind of ambience and will comfort you with saving time.This Shirt is perfect for everyone like school-college student, working and sports person etc. and can be wear in workplaces, house or kitty parties, friendly outings, sports activities or even while travelling."
"Dennis Lingo Men's Solid Slim Fit Casual Shirt  ₹522₹522 ₹1,849₹1,849 ",3.8 out of 5 stars,522,"₹522₹1,849",https://www.amazon.in//Dennis-Lingo-Casual-C301_SkyBlue_L_Sky-Blue_L/dp/B079S5GVRK/ref=sr_1_4?dchild=1&keywords=shirts&qid=1620052587&s=computers&sr=1-4,"Product Details:This Casual Solid shirt has a Mandarin / Chinese collar, full button Placket, Long Sleeves, and a curved hemlineSize and FitSlim FitThe Model (height 6 foot and shoulders 18 inches is wearing size 40/MPlease check the size chart for more details before orderingMaterial & Care100% Premium Cotton (Machine Wash Regular)Style TipEnhance your look by wearing this Casual Stylish Men's shirt. Team it with a pair of Chinos and white sneakers for a fun Smart Casual lookAbout the Brand DENNIS LINGOFinding Basic Menswear for daily use can be hard among todays Fast fashion world, where trends change daily. That’s why we started Dennis Lingo, to create a one stop shop for premium essential clothing for everyday use at lowest prices","Product Dimensions:30 x 24 x 1 cm; 200 GramsDate First Available:2 August 2019Manufacturer:Swastik CreationASIN:B07W2YBGJ3Item model number:C301_B-GREEN_SDepartment:MenManufacturer:Swastik Creation, Swastik Creation -B-21, Bharat Ind. Estate, Sewree (w) ,Mumbai-15, Email - dennislingoshirts@gmail.com, Phone No. 022-22010742Packer:Swastik Creation -B-21, Bharat Ind. Estate, Sewree (w) ,Mumbai-15, Email - dennislingoshirts@gmail.com, Phone No. 022-22010742Item Weight:200 gItem Dimensions LxWxH:30 x 24 x 1 CentimetersNet Quantity:1 NumbersIncluded Components:Casual ShirtGeneric Name:Casual Shirt",Care Instructions: Machine WashFit Type: slim fitColor Name: Bottle Green100% CottonLong sleeveSlim fitMachine wash
Allen Solly Men's Plain Slim Fit Casual Shirt  ,3.6 out of 5 stars,729,"₹729₹1,399",https://www.amazon.in//gp/bestsellers/apparel/1968094031/ref=sr_bs_4_1968094031_1,,,
Sitafal Trendz Mens Shirts Mens Half Sleeve Shirts - Men's Summer Shirt Rayon Cotton Lining Digital Printed Stitched Half Sleeve Shirt  ,2.1 out of 5 stars,649,"₹649₹1,449",https://www.amazon.in//Sitafal-Trendz-Mens-Shirts-Sleeve/dp/B092J1G2BR/ref=sr_1_6?dchild=1&keywords=shirts&qid=1620052587&s=computers&sr=1-6,"We Launch exclusive new range of high quality printed casual shirt for mans under range; This printed casual shirt has slim collar; a full button placket; long sleeves; and a curved hemline; the product made out of best quality Rayon. It designed for comfort and style; it can be worn to parties; casual meetings or a movie date. Make it up with a pair of denims; chinos; shorts or formal trousers and set the town on fire with your Style. 100% Washable Digital Printed Shirts Fabric White Hand-wash, MACHINE WASH DIGITAL PRINTED SHIRTS. This shirt made of premium quality material. Searching for casual shirts for this summer or festive? Then this smart shirt, Digital Printed Sanskar Fashion shirt from the house of Sanskar Fashion Garments are here to end your search. This amazing printed shirt will make you fall in love with the attractive colour. It's very cool on skin. Quality 100% premium fabric is really different from others. Design The shirt features a half sleeve and a Regular collar design which gives the shirt a stylish look and feel. For any of your casual evenings this shirt can be your option to wear.",Date First Available:8 April 2021ASIN:B092HT3LKGItem part number:WOOLFDepartment:MenNet Quantity:1.00 count,Care Instructions: Dry Clean OnlyFit Type: Regular FitCare Instructions: Hand Wash OnlyFit Type: WesternPLEASE CHECK THE SIZE BEFORE ORDER - MEASURE WITH YOUR BODY SIZECare Instructions: Hand Wash Only Fit Type: Regular Fit : Breathable : truly comfortable and easy to wear in every season it is insulating in winter and breathable in summerStylish Half sleeve casual Printed Shirts & Party Wear Casual shirtsPattern: Digital Printed Cotton Shirts & Party Wear Printed Cotton Shirts. Stylish Printed Casual Shirt
IndoPrimo Men's Slim Fit Casual Shirt  ,3.8 out of 5 stars,699,"₹699₹1,999",https://www.amazon.in//IndoPrimo-Cotton-Casual-Stylish-Sleeve/dp/B08R21T75D/ref=sr_1_7?dchild=1&keywords=shirts&qid=1620052587&s=computers&sr=1-7,"Shop from a wide range of Casual Shirt from IndoPrimo . Perfect for your everyday use, you could pair it with a stylish pair of Jeans or Trousers complete the look.",Is Discontinued By Manufacturer:NoPackage Dimensions:14 x 14 x 4 cm; 300 GramsDate First Available:31 August 2018Manufacturer:IndoPrimoASIN:B08R21DKPCItem part number:Men's Stylish Casual Shirt LizaDepartment:MenManufacturer:IndoPrimoItem Weight:300 gNet Quantity:1.00 Unit,"Care Instructions: Hand Wash OnlyFit Type: Regular Fit100% High-grade Cotton Fabrics: Good capability of tenderness, air permeability and moisture absorption feels soft and comfy.Suitable for: Sports, Casual, Business Work, Date, Party, Perfect gift for families, friends and boyfriendSlim Fit , Fabric: 100% Cotton , Full Sleeve ,Casual ShirtsHigh Quality Fabric and StitchingWash Instruction: Handwash / Machine wash| Low iron and tumble dry on low heat"
SIFOJON Men's Cotton Lining Digital Printed Shirt Fabric (Free Size) Bye 2 get 1 free  ,3.5 out of 5 stars,489,"₹489₹1,599",https://www.amazon.in//gp/bestsellers/apparel/5229857031/ref=sr_bs_7_5229857031_1,,,
Dennis Lingo Men's Solid Slim Fit Casual Shirt  ,3.9 out of 5 stars,522,"₹522₹1,849",https://www.amazon.in//Dennis-Lingo-Solid-Casual-CC201_Dustypink_M_Dustypink_M/dp/B07HK6NT81/ref=sr_1_9?dchild=1&keywords=shirts&qid=1620052587&s=computers&sr=1-9,"Product Details:This Casual Solid shirt has a Mandarin / Chinese collar, full button Placket, Long Sleeves, and a curved hemlineSize and FitSlim FitThe Model (height 6 foot and shoulders 18 inches is wearing size 40/MPlease check the size chart for more details before orderingMaterial & Care100% Premium Cotton (Machine Wash Regular)Style TipEnhance your look by wearing this Casual Stylish Men's shirt. Team it with a pair of Chinos and white sneakers for a fun Smart Casual lookAbout the Brand DENNIS LINGOFinding Basic Menswear for daily use can be hard among todays Fast fashion world, where trends change daily. That’s why we started Dennis Lingo, to create a one stop shop for premium essential clothing for everyday use at lowest prices","Product Dimensions:30 x 24 x 1 cm; 200 GramsDate First Available:11 June 2018Manufacturer:Swastik CreationASIN:B07D9VVXKQItem model number:CC201_BROWNDepartment:MenManufacturer:Swastik Creation, Swastik Creation -B-21, Bharat Ind. Estate, Sewree (w) ,Mumbai-15, Email - dennislingoshirts@gmail.com, Phone No. 022-22010742Packer:Swastik Creation -B-21, Bharat Ind. Estate, Sewree (w) ,Mumbai-15, Email - dennislingoshirts@gmail.com, Phone No. 022-22010742Item Weight:200 gItem Dimensions LxWxH:30 x 24 x 1 CentimetersNet Quantity:1 NumbersIncluded Components:Casual ShirtGeneric Name:Shirt","Care Instructions: Machine WashFit Type: slim fit100% premium Cotton, pre washed for an extremely soft finish and rich lookStylish full sleeve casual shirtModern slim fit ( we have updated our size chart, please refer the size chart for new measurements before ordering)Best for casual & smart casual wearSize chart - s-38, m-40, cold-42, xl-44, xxxl-46"
Leriya Fashion Offers All Kinds of Tops for Both Women and Girls - Tops for Women  ,3.5 out of 5 stars,349,"₹349₹1,999",https://www.amazon.in//Leriya-Fashion-Womens-Sleeves-36-inch/dp/B07MZ4GNGD/ref=sr_1_10?dchild=1&keywords=shirts&qid=1620052587&s=computers&sr=1-10,"Crisp white Slab Cotton shirt, has a mandarin collar, three-quarter bell sleeves with tie-up detail, concealed full button placket, straight hem. This product is made of Synthetic, Crape. Available in size :- S, M, L and XL. Ideal for daily, casual, party/evening, office/work wear, or semi formal occasion . Very nice and comfortable smart western wear clothes for women designed in line with the best international trends.Latest fashion that looks great and stylish on girls and would make an amazing gift. Note - the colour might appear slightly different due to changes in your screen resolution.","Product Dimensions:12 x 12 x 2 cm; 249 GramsDate First Available:19 November 2019Manufacturer:Leriya FashionASIN:B085HWRC3HItem model number:LF-W1223-SDepartment:WomenManufacturer:Leriya Fashion, Leriya FashionItem Weight:249 gItem Dimensions LxWxH:12 x 12 x 2 CentimetersNet Quantity:1.00 countGeneric Name:Top",Care Instructions: Dry Clean OnlyFit Type: Regular FitColor Name: BlackMaterial: RayonDry clean onlyTunicThree Quarter sleeveRound neck
Zombom Men's Regular Fit Casual Shirt  ,3.8 out of 5 stars,659,"₹659₹2,549",https://www.amazon.in//Zombom-Sleeve-Cotton-Casual-Shirt/dp/B078V94BZS/ref=sr_1_11?dchild=1&keywords=shirts&qid=1620052587&s=computers&sr=1-11,,Package Dimensions:22.8 x 21.6 x 6.7 cm; 240 GramsDate First Available:30 November 2017Manufacturer:ZombomASIN:B078VB9TGJItem part number:ZBSH705_Black_38Department:MenManufacturer:ZombomItem Weight:240 g,Fit Type: Regular FitFabric: 100% CottonStyle: RegularNeck Style: CollaredPattern: SolidSleeve Type: Full Sleeve
Kevin Swift Men's Printed Regular Fit Casual Shirt  ,3.9 out of 5 stars,499,"₹499₹1,670",https://www.amazon.in//Kevin-Swift-Printed-Regular-rt43greenl_Sage/dp/B08C8M2DY8/ref=sr_1_12?dchild=1&keywords=shirts&qid=1620052587&s=computers&sr=1-12,,"Product Dimensions:18 x 18 x 1 cm; 300 GramsDate First Available:2 July 2020Manufacturer:Kevin SwiftASIN:B08C8KP8BWItem model number:rt43greysDepartment:MenManufacturer:Kevin Swift, Retail Boost, Udhna Udyog Nagar, SuratPacker:Retail Boost, Udhna Udyog Nagar, SuratImporter:Not Imported. Made in IndiaItem Weight:300 gItem Dimensions LxWxH:18 x 18 x 1 CentimetersGeneric Name:Casual Shirt",Care Instructions: Hand Wash OnlyFit Type: regular fitFlint GreyFabric: 100% Premium CotttonWash Care: Hand Washregular fitlong sleeve
"Amazon Brand - Inkast Denim Co. Men's Slim Fit Casual Shirt  ₹549₹549 ₹2,199₹2,199 ",3.8 out of 5 stars,549,"₹549₹2,199",https://www.amazon.in//Amazon-Brand-Inkast-S-33A_Ice-Blue_Medium/dp/B07GSH83Y6/ref=sr_1_13?dchild=1&keywords=shirts&qid=1620052587&s=computers&sr=1-13,"INKAST 100% Cotton Indigo casual shirt. Apt for casual outings, this shirt keeps you comfortble and stylish all day long.",Package Dimensions:36.4 x 28.4 x 4.6 cm; 360 GramsDate First Available:23 August 2018Manufacturer:Inkast Denim Co.ASIN:B07GSL2C8SItem model number:IN-S-33ADepartment:MenManufacturer:Inkast Denim Co.Item Weight:360 gGeneric Name:Casual Shirt,"Care Instructions: Machine WashFit Type: Slim FitMaterial - 100% CottonSlim fit and Full sleeve shirtCollar style - Button down collar; Cuff style - Single cuffPattern - Solid Men’s Casual ShirtIndigo dyed ice washed shirt with button down collar & stylised chest pocketMachine wash warm, wash dark colors separately, do not bleach, tumble dry low, warm Iron"
US Polo Kids Boys' Plain Regular Fit Shirt  ,,529,"₹529₹1,299",https://www.amazon.in//US-Polo-Regular-UJSH5227_Me-Yellow_EL/dp/B07FPFF5PY/ref=sr_1_14?dchild=1&keywords=shirts&qid=1620052587&s=computers&sr=1-14,boys-shirt-y/d swriper oxford-hs-me. yellow-me. yellow -fashion,"Product Dimensions:36 x 28 x 5 cm; 300 GramsDate First Available:19 July 2018Manufacturer:Arvind Lifestyle Brands Pvt LtdASIN:B07FPFF5PYItem model number:UJSH5227Country of Origin:IndiaDepartment:BoysManufacturer:Arvind Lifestyle Brands Pvt Ltd, ARVIND LIFESTYLE BRANDS LTD, Du parc trinity, 8th floor, 17, M.G. Road, banglore - 560001Packer:ARVIND LIFESTYLE BRANDS LTD, Du parc trinity, 8th floor, 17, M.G. Road, banglore - 560001Item Weight:300 gItem Dimensions LxWxH:36 x 28 x 5 CentimetersGeneric Name:Shirt",Care Instructions: Machine WashFit Type: regular fitMaterial: cottonHalf sleevemachine wash
IndoPrimo Men's Regular Fit Casual Shirt  ,4.0 out of 5 stars,699,"₹699₹1,999",https://www.amazon.in//IndoPrimo-Cotton-Casual-Shirt-Sleeves/dp/B08JHT17CV/ref=sr_1_15?dchild=1&keywords=shirts&qid=1620052587&s=computers&sr=1-15,,Is Discontinued By Manufacturer:NoDate First Available:31 August 2018Manufacturer:IndoPrimoASIN:B08KQ2Y4NHItem part number:Latest Men's Casual Shirt 1Department:MenManufacturer:IndoPrimo,"Care Instructions: First Time Dry-Clean followed by hand washFit Type: Regular Fit100% High-grade Cotton Fabrics: Good capability of tenderness, air permeability and moisture absorption feels soft and comfy.Suitable for: Sports, Casual, Business Work, Date, Party, Perfect gift for families, friends and boyfriendSlim Fit , Fabric: 100% Cotton , Full Sleeve ,Casual ShirtsHigh Quality Fabric and StitchingWash Instruction: Machine/Hand-wash in cold water , Low iron and tumble dry on low heat"
Amazon Brand - Symbol Men's Regular Casual Shirt  ,4.0 out of 5 stars,569,"₹569₹1,899",https://www.amazon.in//Amazon-Brand-Checkered-Regular-AZ-SY-RR01_9322_Red-Black_Large/dp/B07QGK8PD2/ref=sr_1_16?dchild=1&keywords=shirts&qid=1620052587&s=computers&sr=1-16,"Amazon బ్రాండ్, సింబల్ నాణ్యత, విశ్వసనీయత మరియు సరసమైన స్తంభాలపై నిర్మించబడింది, ఇది ప్రతిరోజూ మంచిగా కనిపించడానికి సహాయపడే అనేక జీవనశైలి ఎసెన్షియల్స్ అందిస్తుంది. Symbol మిమ్మల్ని సూక్ష్మంగా మరియు సౌకర్యవంతంగా ఉంచే వివిధ రంగులలో క్లాసిక్ క్యాజువల్ షర్టుల శ్రేణిని తెస్తుంది. సౌకర్యం కోసం నిర్మించిన, మా ముఖ్యమైన క్యాజువల్ చొక్కాలు ప్రతి మనిషి వార్డ్రోబ్లో కనిపిస్తాయి. ఈ రెగ్యులర్ ఫిట్ 100% కాటన్ చెక్ షర్ట్ ఒకే ఛాతీ జేబుతో రెగ్యులర్ కాలర్లో రూపొందించబడింది. టాబ్తో స్లీవ్లను రోల్ చేయండి Red నేవీ చెక్స్ యొక్క ఈ క్లాసిక్ కలయికను తప్పనిసరిగా కలిగి ఉండాలి. బహుముఖ క్యాజువల్ లుక్ కోసం తెలుపు స్నీకర్లతో ఒక జత డెనిమ్స్తో ఈ చొక్కా ధరించండి.An Amazon brand, Symbol is built on the pillars of quality, reliability and affordability, offering a range of lifestyle essentials that help you look good every day. Symbol brings a range of classic casual shirts in a variety of colors that keep you subtle & comfortable. Built for comfort, our essential pair of casual shirts find place in every man’s wardrobe. This Regular fit 100% cotton check shirt is designed in regular collar with single chest pocket. Roll up sleeves with tab make this classic combination of Red Navy checks a must have. Wear this shirt with a pair of denims with white sneakers for a versatile casual look.ഒരു Amazon ബ്രാൻഡ്, ഗുണനിലവാരം, വിശ്വാസ്യത, വില താങ്ങാനുള്ള കഴിവ് എന്നിവയുടെ പില്ലറുകളിലാണ് സിംബൽ നിർമ്മിച്ചിരിക്കുന്നത്, ഇത് എല്ലാ ദിവസവും മികച്ചതായി കാണാൻ സഹായിക്കുന്ന ജീവിതശൈലി അവശ്യവസ്തുക്കൾ വാഗ്ദാനം ചെയ്യുന്നു. സിംബൽ വൈവിധ്യമാർന്ന നിറങ്ങളിൽ ക്ലാസിക് കാഷ്വൽ ഷർട്ടുകൾ കൊണ്ടുവരുന്നു, അത് നിങ്ങളെ സൂക്ഷ്മവും സുഖകരവുമാക്കുന്നു. സുഖസൗകര്യങ്ങൾക്കായി നിർമ്മിച്ചത്, ഞങ്ങളുടെ അവശ്യ ജോഡി കാഷ്വൽ ഷർട്ടുകൾ ഓരോ പുരുഷന്‍റെ വാർഡ്രോബിൽ സ്ഥാനം കണ്ടെത്തുന്നു. ഈ റെഗുലർ ഫിറ്റ് 100% കോട്ടൺ ചെക്ക് ഷർട്ട് സാധാരണ കോളറിൽ രൂപകൽപ്പന ചെയ്തിരിക്കുന്നു. ടാബിനൊപ്പം സ്ലീവ് ചുരുട്ടുന്നത് Red Navy ചെക്കുകളുടെ ക്ലാസിക് സംയോജനമാക്കുന്നു. വൈവിധ്യമാർന്ന കാഷ്വൽ രൂപത്തിനായി വെളുത്ത സ്നീക്കറുകളുള്ള ഈ ഷർട്ട് ഒരു ജോഡി ഡെനിമിനോടൊപ്പം ധരിക്കുക.ஒரு Amazon பிராண்ட், Symbol தரம், நம்பகத்தன்மை மற்றும் மலிவு ஆகியவற்றின் தூண்களில் கட்டப்பட்டுள்ளது, இது ஒவ்வொரு நாளும் அழகாக இருக்க உதவும் வாழ்க்கை முறை அத்தியாவசியங்களை வழங்குகிறது. உங்களுக்கு நுட்பமான மற்றும் வசதியாக இருக்கும் பல்வேறு வண்ணங்களில் கிளாசிக் கேஷுவல் சட்டைகளை Symbol கொண்டு வருகிறது. சௌகரியத்திற்காக உருவாக்கப்பட்ட எங்கள் அத்தியாவசிய ஜோடி கேஷுவல் சட்டைகள் ஒவ்வொரு ஆணின் அலமாரிகளிலும் காணப்படுகின்றன. இந்த ரெகுலர் ஃபிட் 100% காட்டன் செக் ஷர்ட் வழக்கமான காலரில் ஒற்றை மார்பு பாக்கெட்டுடன் வடிவமைக்கப்பட்டுள்ளது. நாடாவுடன் ரோல் அப் ஸ்லீவ்ஸ் இந்த கிளாசிக் சிகப்பு நேவி காசோலைகளின் கலவையை உருவாக்குகின்றன. பல பயன் கொண்ட கேஷுவல் தோற்றத்திற்காக வெள்ளை ஸ்னீக்கர்களுடன் ஒரு ஜோடி டெனிம்களுடன் இந்த சட்டையை அணியுங்கள்.Amazon ಬ್ರ್ಯಾಂಡ್, ಚಿಹ್ನೆಯನ್ನು ಗುಣಮಟ್ಟ, ವಿಶ್ವಾಸಾರ್ಹತೆ ಮತ್ತು ಕೈಗೆಟಕುವ ಸ್ತಂಭಗಳ ಮೇಲೆ ನಿರ್ಮಿಸಲಾಗಿದೆ, ಇದು ಪ್ರತಿದಿನ ಉತ್ತಮವಾಗಿ ಕಾಣಲು ಸಹಾಯ ಮಾಡುವ ಜೀವನಶೈಲಿಯ ಅಗತ್ಯ ವಸ್ತುಗಳನ್ನು ನೀಡುತ್ತದೆ. ಚಿಹ್ನೆ ನಿಮ್ಮನ್ನು ಸೂಕ್ಷ್ಮ ಮತ್ತು ಆರಾಮದಾಯಕವಾಗಿರುವ ವಿವಿಧ ಬಣ್ಣಗಳಲ್ಲಿ ಕ್ಲಾಸಿಕ್ ಕ್ಯಾಶುಯಲ್ ಶರ್ಟ್ಗಳ ಶ್ರೇಣಿಯನ್ನು ತರುತ್ತದೆ. ಆರಾಮಕ್ಕಾಗಿ ನಿರ್ಮಿಸಲಾಗಿದೆ, ನಮ್ಮ ಅಗತ್ಯ ಜೋಡಿ ಕ್ಯಾಶುಯಲ್ ಶರ್ಟ್ಗಳು ಪ್ರತಿಯೊಬ್ಬ ಪುರುಷರ ವಾರ್ಡ್ರೋಬ್ನಲ್ಲಿ ಸ್ಥಳವನ್ನು ಕಂಡುಕೊಳ್ಳುತ್ತವೆ. ಈ ನಿಯಮಿತ ಫಿಟ್ 100% ಹತ್ತಿ ಚೆಕ್ ಶರ್ಟ್ ಅನ್ನು ಸಾಮಾನ್ಯ ಕಾಲರ್ನಲ್ಲಿ ಸಿಂಗಲ್ ಚೆಸ್ಟ್ ಪಾಕೆಟ್ನೊಂದಿಗೆ ವಿನ್ಯಾಸಗೊಳಿಸಲಾಗಿದೆ. ಟ್ಯಾಬ್ನೊಂದಿಗೆ ತೋಳುಗಳನ್ನು ರೋಲ್ ಅಪ್ ಮಾಡಿ Red Navy ಚೆಕ್ ಗಳ ಈ ಕ್ಲಾಸಿಕ್ ಸಂಯೋಜನೆಯನ್ನು ಹೊಂದಿರಬೇಕು. ಬಹುಮುಖ ಕ್ಯಾಶುಯಲ್ ನೋಟಕ್ಕಾಗಿ ಬಿಳಿ ಸ್ನೀಕರ್ಗಳೊಂದಿಗೆ ಈ ಶರ್ಟ್ ಅನ್ನು ಧರಿಸಿ.",Package Dimensions:29.46 x 24.37 x 4.83 cm; 200 GramsDate First Available:5 April 2019Manufacturer:Amazon Brand - SymbolASIN:B07QDB4CJFItem model number:AZ-SY-RR01_SHAKTI-02Department:MenManufacturer:Amazon Brand - SymbolItem Weight:200 gGeneric Name:Casual Shirt,Care Instructions: Machine WashFit Type: RegularMaterial - 100% CottonRegular fit and Full sleeve shirtCollar style - Classic collar; Cuff style - Single cuffPattern - Checkered Men’s Casual ShirtMachine washMade in India
Van Heusen Sport Men's Checkered Slim fit Formal Shirt  ,4.2 out of 5 stars,779,"₹779₹1,499",https://www.amazon.in//Van-Heusen-Sport-Checkered-VHSFBSLPW13637_Blue/dp/B07K3FKCGL/ref=sr_1_17?dchild=1&keywords=shirts&qid=1620052587&s=computers&sr=1-17,"Van Heusen shirts offers an array of products perfect for any occasions. Upgrade your wardrobe with this white check shirt, tailored in Slim Fit by Van Heusen.",Package Dimensions:34 x 22.4 x 2.4 cm; 260 GramsDate First Available:1 November 2018Manufacturer:Van Heusen SportASIN:B07K3P9FPPItem model number:VHSFBSLPW13637Department:MenManufacturer:Van Heusen SportItem Weight:260 gGeneric Name:Formal Shirt,Care Instructions: Machine WashFit Type: slim fitColour: Blue With WhiteMaterial: cottonSlim fitLong sleeveMachine wash
