title,rating,offer_price,origional_price,url,description,des,dis2
Leriya Fashion Plain Regular fit Women's Wear (Casual Shirt Black-S Small)  ,3.2 out of 5 stars,349,"₹349₹1,999",https://www.amazon.in//Leriya-Fashion-Sleeve-Casual-Crepe/dp/B07HF548ZD/ref=sr_1_18?dchild=1&keywords=shirts&qid=1620052587&s=computers&sr=1-18,The product will be an excellent pick for you. It ensures an easy maintenance.,"Product Dimensions:15 x 15 x 4 cm; 199 GramsDate First Available:25 May 2019Manufacturer:Leriya FashionASIN:B07HF548ZDItem model number:Casual shirt Black-SCountry of Origin:IndiaDepartment:WomenManufacturer:Leriya Fashion, Leriya Fashion - Surat - Gujrat - 9879525010 Add :- 102 Upper Ground Shivkrupa Building Asharwala Compound, Opp. Bambawadi Surat Gujarat India 395972Packer:Leriya Fashion - Surat - Gujrat - 9879525010 Add :- 102 Upper Ground Shivkrupa Building Asharwala Compound, Opp. Bambawadi Surat Gujarat India 395972Importer:Dhrvui Trendz - Surat-Gujrat - 97379 95010 102 Upper Ground Shivkrupa Building Asharwala Compound, Opp. Bambawadi Surat Gujarat India 395004Item Weight:199 gItem Dimensions LxWxH:15 x 15 x 4 CentimetersNet Quantity:1 NumbersIncluded Components:1 TOPGeneric Name:Women's Wear",Care Instructions: Dry Clean OnlyFit Type: regular fitColor Name: BlackCrepeDry clean onlyTunicHalf sleeve
Dennis Lingo Men's Solid Slim Fit Casual Shirt  ,3.9 out of 5 stars,712,"₹712₹2,499",https://www.amazon.in//Dennis-Lingo-Casual-AZ502_DARKBLUE_L_Dark-Blue_L/dp/B0787QSG89/ref=sr_1_19?dchild=1&keywords=shirts&qid=1620052587&s=computers&sr=1-19,"Product Details:This Blue Denim Casual shirt has a spread collar, A full button Placket, Long Sleeves, Yoke on the shoulder, and a curved hemlineSize and FitSlim FitThe Model (height 6 foot and shoulders 18 inches is wearing size 40/LPlease check the size chart for more details before orderingMaterial & Care100% Premium Cotton (Machine Wash Warm)Style TipEnhance your look by wearing this trendy shirt. Team it with a pair of blue denims and white sneakers for a fun Saturday night with friendsStill Confused don’t be, we offer 30 day Return Policy with full refunds(No questions asked)About the Brand DENNIS LINGOFinding Basic premium Essential wear should not be a task, that’s why we started Dennis Lingo, to create a one stop shop for premium essential clothing for everyday use at rock bottom prices","Is Discontinued By Manufacturer:NoProduct Dimensions:30 x 24 x 1 cm; 200 GramsDate First Available:10 June 2018Manufacturer:Swastik CreationASIN:B0787S1HTDItem model number:AZ502_DARKBLUE_SDepartment:MenManufacturer:Swastik Creation, Swastik Creation -B-21, Bharat Ind. Estate, Sewree (w) ,Mumbai-15, Email - dennislingoshirts@gmail.com, Phone No. 022-22010742Packer:Swastik Creation -B-21, Bharat Ind. Estate, Sewree (w) ,Mumbai-15, Email - dennislingoshirts@gmail.com, Phone No. 022-22010742Item Weight:200 gItem Dimensions LxWxH:30 x 24 x 1 CentimetersNet Quantity:1 NumbersIncluded Components:Casual ShirtGeneric Name:Casual Shirt","Care Instructions: Machine WashFit Type: slim fit100% premium denim Cottton, pre washed for an extremely soft finish and rich lookStylish full sleeve casual shirtModern slim fit ( we have updated our size chart, please refer the size chart for new measurements before ordering)Best for casual & smart casual wearSize chart - s-38, m-40, cold-42, xl-44, xxxl-46"
Dennis Lingo Men's Checkered Slim Fit Cotton Casual Shirt  ,3.7 out of 5 stars,699,"₹699₹2,499",https://www.amazon.in//Dennis-Lingo-Checkered-D-Blue-AZ751_D-Blue_M/dp/B08YNWZ2VQ/ref=sr_1_20?dchild=1&keywords=shirts&qid=1620052587&s=computers&sr=1-20,"Product Details:This Casual Checkered shirt has a Slim Collar, Full Sleeves and a curved hemlineSize and FitSlim FitThe Model (height 6 foot and shoulders 18 inches is wearing size 40/MPlease check the size chart for more details before orderingMaterial & Care100% Premium Cotton (Machine Wash Regular)Style TipEnhance your look by wearing this Casual Stylish Men's shirt, Team it with a pair of rugged tapered denims/Or Solid Chinos and White Sneakers for a fun Casual Casual lookAbout the Brand DENNIS LINGOFinding Basic Menswear for daily use can be hard among todays Fast fashion world, where trends change daily. That’s why we started Dennis Lingo, to create a one stop shop for premium essential clothing for everyday use at lowest prices","Product Dimensions:30 x 24 x 1 cm; 220 GramsDate First Available:11 March 2021Manufacturer:Swastik Creation -Gala no.B-21,Bharat Industrial estate, T.J. Road, Sewree (w) ,Mumbai - 400059ASIN:B08YNXHPVWItem part number:AZ751_D-BLUE_SDepartment:MenManufacturer:Swastik Creation -Gala no.B-21,Bharat Industrial estate, T.J. Road, Sewree (w) ,Mumbai - 400059, Swastik Creation -Gala no.B-21,Bharat Industrial estate, T.J. Road, Sewree (w) ,Mumbai - 400025Item Weight:220 gItem Dimensions LxWxH:30 x 24 x 1 CentimetersNet Quantity:1.00 countGeneric Name:Shirt","Care Instructions: Machine WashFit Type: Slim FitFabric - 100% Premium Cotton, Pre-Washed for extremely soft finish and Guaranteed 0% Shrinkage Post WashingStyle - Enhance your look by wearing this Casual Stylish Men's shirt, Team it with a pair of tapered Denims Or Solid Chinos and Loafers for a fun Smart Casual lookFit Type - Size chart - S-38, M-40, L-42, XL-44, XXL-46. Please Check the Size chart before Ordering for the Perfect FitAbout the Brand DENNIS LINGO - Finding Basic Menswear for daily use can be hard among todays Over priced Fast fashion world, where trends change daily. That’s why we started Dennis Lingo, to create a one stop shop for premium essential clothing for everyday use at lowest prices and bring Basics back in trend."
Dennis Lingo Men's Checkered Slim Fit Casual Shirt (C417_Green_M_Green_M)  ,3.9 out of 5 stars,617,"₹617₹2,499",https://www.amazon.in//Dennis-Lingo-Checkered-Casual-C417_Green_XL_Green_XL/dp/B07D9SH8VV/ref=sr_1_21?dchild=1&keywords=shirts&qid=1620052587&s=computers&sr=1-21,,"Product Dimensions:30 x 24 x 1 cm; 200 GramsDate First Available:25 May 2018Manufacturer:Swastik CreationASIN:B07D9TYDMFItem model number:C417_GREEN_SDepartment:MenManufacturer:Swastik Creation, Swastik Creation -B-21, Bharat Ind. Estate, Sewree (w) ,Mumbai-15, Email - dennislingoshirts@gmail.com, Phone No. 022-22010742Packer:Swastik Creation -B-21, Bharat Ind. Estate, Sewree (w) ,Mumbai-15, Email - dennislingoshirts@gmail.com, Phone No. 022-22010742Item Weight:200 gItem Dimensions LxWxH:30 x 24 x 1 CentimetersNet Quantity:1 NumbersIncluded Components:Casual ShirtGeneric Name:Casual Shirt","Care Instructions: Machine WashFit Type: slim fit100% premium Cotton, pre washed for an extremely soft finish and rich lookStylish full sleeve checkered casual shirtModern slim fit ( we have updated our size chart, please refer the size chart for new measurements before ordering)Best for casual & smart casual wearSize chart - s-38, m-40, cold-42, xl-44, xxxl-46"
BEING FAB Men's Regular fit Casual Shirt  ,3.3 out of 5 stars,399,"₹399₹1,200",https://www.amazon.in//BEING-FAB-Cotton-Casual-Shirt/dp/B082D3HL82/ref=sr_1_22?dchild=1&keywords=shirts&qid=1620052587&s=computers&sr=1-22,"Look trendy and live trendy with a wide range of apparel. Our brand provides quality products which are made from quality material. Which adds beauty and gives an elegant look. There are various collection of products available to choose from. Shop from a wide range of shirt from being fab. Perfect for your everyday use, you could pair it with a stylish pair of jeans or trousers complete the look.","Package Dimensions:26.2 x 20.5 x 4.2 cm; 250 GramsDate First Available:12 November 2015Manufacturer:Fab Lifestyle Pvt LtdASIN:B082D3HL82Item model number:BFRYBLUESHT02-44Country of Origin:IndiaDepartment:MenManufacturer:Fab Lifestyle Pvt Ltd, FAB LIFESTYLE PRIVATE LIMITED, G-25/35 Gali No-1B, 40 Feet Road, Molarband Ext, Badarpur, New Delhi - 110044, Contact No - 9555982323Packer:Fab Lifestyle Pvt Ltd- H No-G-25/35 Gali No-1B 400 Feet Road Molarband Extn Badarpur New Delhi-110044Item Weight:250 gGeneric Name:Casual Shirt",Color name: Royal BlueMaterial: CottonPattern: solidlong sleeveMachine wash
GRITSTONES Men's Regular FiT-Shirt  ,3.8 out of 5 stars,444,"₹444₹1,499",https://www.amazon.in//GRITSTONES-White-Cotton-Sleeve-GSOMBHSSHRT2549WHTMGRN_XL/dp/B086XFSXV9/ref=sr_1_23?dchild=1&keywords=shirts&qid=1620052587&s=computers&sr=1-23,"Shop from a wide range of Shirt from GRITSTONES . Perfect for your everyday use, you could pair it with a stylish pair of Jeans or Trousers complete the look.",Product Dimensions:30 x 30 x 2 cm; 200 GramsDate First Available:9 April 2020Manufacturer:DB CREATIONSASIN:B086XFSV6HItem part number:GSOMBHSSHRT2549WHTCRL_SDepartment:MenManufacturer:DB CREATIONSItem Weight:200 gItem Dimensions LxWxH:30 x 30 x 2 Centimeters,Fit Type: Regular FitFabric: CottonNeck Style: Button FrontPattern: Tie-Dye
EYEBOGLER Regular Fit Men's Cotton T-Shirt  ,3.9 out of 5 stars,379,"₹379₹1,299",https://www.amazon.in//EYEBOGLER-Regular-Auto-Striper-T-Shirt-M-T285HS-AS7WHDNGR_1/dp/B08CDR8CDG/ref=sr_1_24?dchild=1&keywords=shirts&qid=1620052587&s=computers&sr=1-24,"EyeBogler t-shirts are made up of Polycotton with 180 GSM fabric, not to heavy but simply PERFECT for Indian summer. Our fabrics are tested for shrinkage, colorfastness, and treated with silicone to give the customer the ultimate experience of quality T-shirts.","Product Dimensions:29 x 40 x 1 cm; 240 GramsDate First Available:6 July 2020Manufacturer:Seven Rocks International, Cheema Chowk, Ludhiana.ASIN:B08CDRS2NYItem model number:T285HS1Department:MenManufacturer:Seven Rocks International, Cheema Chowk, Ludhiana., Seven Rocks International, Cheema Chowk, Ludhiana.Packer:Seven Rocks International, Cheema Chowk, Ludhiana.Importer:Seven Rocks International, Cheema Chowk, Ludhiana.Item Weight:240 gItem Dimensions LxWxH:29 x 40 x 1 CentimetersGeneric Name:T-Shirt",Care Instructions: Machine WashFit Type: regular fitCare Instructions: Machine washFit Type: regular fitCotton Polyester Blend: 60% Cotton and 40% PolyesterRegular fit and dimensionally accurate sizeUnique design with excellent durable fabric
,,,,https://www.amazon.in/#s-skipLinkTargetForMainSearchResults,,,
