title,rating,offer_price,origional_price,url,description,des,dis2
ASUS TUF FX766LI-H7061T I7-10TH GENERATION 4GB 16GB 512SSD 17.3 INCH  ,5.0 out of 5 stars,"86,990","₹86,990₹1,23,990",https://www.amazon.in//ASUS-FX766LI-H7061T-I7-10TH-GENERATION-512SSD/dp/B08QJS1WRD/ref=sr_1_1?dchild=1&keywords=shirts&qid=1620302108&s=computers&sr=1-1,ASUS TUF Gaming F17 FX766LI-H7061T Intel Core i7-10750H/GTX1650Ti-4GB/16GB/512GB SSD/17.3 FHD-120hz/WIN 10 HOME/1y,,It has Intel Core i7-10750H  It has Windows 10  It is a Gaming Laptop
"Acer Nitro 5 Intel Core i5-10300H 15.6-inch Full HD IPS 1920 x 1080 144Hz Display Gaming Notebook (8GB Ram/1TB HDD + 256GB SSD/Windows 10 Home/GTX 1650Ti Graphics/Obsidian Black/2.3 kgs), AN515-55  ",3.9 out of 5 stars,"71,990","₹71,990₹89,990",https://www.amazon.in//gp/slredirect/picassoRedirect.html/ref=pa_sp_mtf_computers_sr_pg1_1?ie=UTF8&adId=A05450211EQPSZ02KWEHM&url=%2FAcer-i5-10300H-15-6-inch-Notebook-AN515-55%2Fdp%2FB088FLNT3G%2Fref%3Dsr_1_2_sspa%3Fdchild%3D1%26keywords%3Dshirts%26qid%3D1620302108%26s%3Dcomputers%26sr%3D1-2-spons%26psc%3D1&qualifier=1620302108&id=3062066636277413&widgetName=sp_mtf,"Enjoy premium looks without the premium price with the Acer NITRO Gaming notebook (model AN515-55), which features a beautiful exterior. It features a 15.6-inch high-def. display giving you ample space for opening multiple windows and digital entertainment. It's powered by Intel Core i5-10th Gen processor. Enjoy smooth multitasking and excellent performance with 8GB installed RAM and 1TB HDD + 256GB SSD along with DTS® X:Ultra Audio systems and NVIDIA GeForce GTX 1650Ti with 4 GB.",,"Processor: Intel Core i5-10300H processor, turbo up to 4.5 GhzDisplay: 15.6"" display with IPS (In-Plane Switching) technology, Full HD supporting 144HzMemory: 8 GB of DDR4 system memory, upgradable to 32 GBStorage: 1 TB HDD 7200RPM + 256 GB SSDGraphics: NVIDIA GeForce GTX 1650Ti with 4GB of dedicated GDDR6 VRAMDTS X:Ultra Audio, featuring optimized Bass, Loudness, Speaker Protection with up to 6 custom content modes by smart amplifierWarranty: One-year International Travelers Warranty (ITW)"
Ontarious Look Men's Cotton Digital Printed Half Sleeves Shirt  ,3.6 out of 5 stars,499,₹499₹999,https://www.amazon.in//Ontarious-Look-Digital-Printed-Sleeves/dp/B091F9CNNV/ref=sr_1_2?dchild=1&keywords=shirts&qid=1620302108&s=computers&sr=1-2-catcorr,"Crafted in a pure cotton fabric, this half-sleeved, regular-fit modern shirt offers superb comfort and an impeccable finish.  A reliable option for business wear, the shirt features a modern collar. Team with tailored trousers and blazer for a pared-back professional look. For that super smart weekend style, modern men can pick this casual shirt from Ontarious Look. Detailed with printed effect all over, this short-sleeved shirt is surely not to be missed out on. Made from cotton fabric, this shirt can be clubbed with denims and casual shoes. Look smart in casual/ formal/ partywear shirt from the house of Ontarious. The stylish look enhances the overall appreal of this shirt. This shirt ensures great comfort all day long. This shirt can be best teamed with a pair of trousers,jeans,chinos and lace-ups. Color and Sizes available. ",Date First Available:31 March 2021Manufacturer:Ontarious LookASIN:B091F9268NItem part number:OL_Shree_Shirt_Black_MDepartment:MenManufacturer:Ontarious LookNet Quantity:1.00 count,"Care Instructions: Machine WashFit Type: RegularMade of 100% Cotton, soft, comfy and breathable.Look trendy and feel comfortable with this Shirt.This Shirt will cater a rich in-class and genuine appearance in any kind of ambience and will comfort you with saving time.This Shirt is perfect for everyone like school-college student, working and sports person etc. and can be wear in workplaces, house or kitty parties, friendly outings, sports activities or even while travelling."
The Indian Garage Co Men's Slim Fit Shirt  ,3.7 out of 5 stars,706,"₹706₹1,749",https://www.amazon.in//Indian-Garage-Co-1119-SH25-10-Medium/dp/B087S6FJ33/ref=sr_1_4?dchild=1&keywords=shirts&qid=1620302108&s=computers&sr=1-4-catcorr,The Indian Garage Co Grey Slim Fit Checked Shirts,Product Dimensions:32 x 27 x 2.5 cm; 500 GramsDate First Available:28 April 2020Manufacturer:The Indian Garage CoASIN:B087S6FJ33Item model number:1119-SH25-10-GreyDepartment:MenManufacturer:The Indian Garage CoItem Weight:500 gItem Dimensions LxWxH:32 x 27 x 2.5 CentimetersGeneric Name:Shirt,Care Instructions: Machine WashFit Type: Slim FitColor name: GreyMaterial: CottonLong SleevesMachine Wash
"HELLCAT Boy's T-shirt (Set of 3)  ₹576₹576 ₹2,299₹2,299 ",4.1 out of 5 stars,576,"₹576₹2,299",https://www.amazon.in//HELLCAT-T-shirt-HFT-VP3-020_021_017-Parent_Multicolored_15-16-Years/dp/B08D6W6VD1/ref=sr_1_23?dchild=1&keywords=shirts&qid=1620302108&s=computers&sr=1-23-catcorr,This super comfortable T-Shirt by HELLCAT is a must have for your little one. Pair it with a casual pair of jeans and comfortable shoes for a playdate.,"Package Dimensions:22.4 x 21.3 x 7.4 cm; 330 GramsDate First Available:25 November 2020Manufacturer:Bodyglove Apparel IndiaASIN:B08D6XHTRWItem part number:HFT-VP3-020_021_017-$ParentDepartment:BoysManufacturer:Bodyglove Apparel India, Bodyglove Apparel India, No.21, Muthusamy 6th Cross Street, College Road, Tirupr- 641602, Ph:9842595258Item Weight:330 g",Care Instructions: Machine WashFit Type: Regular FitWash Care: Machine WashFabric Type: cottonPattern name: GraphicSleeve Type: Half SleeveCollar Style: Round Collar;
Van Heusen Sport Men's Checkered Slim fit Formal Shirt  ,4.2 out of 5 stars,980,"₹980₹1,499",https://www.amazon.in//Van-Heusen-Sport-Checkered-VHSFBSLPW13637_Blue/dp/B07K3FKCGL/ref=sr_1_10?dchild=1&keywords=shirts&qid=1620302108&s=computers&sr=1-10-catcorr,"Van Heusen shirts offers an array of products perfect for any occasions. Upgrade your wardrobe with this white check shirt, tailored in Slim Fit by Van Heusen.",Package Dimensions:35.2 x 24.8 x 5.5 cm; 260 GramsDate First Available:1 November 2018Manufacturer:Van Heusen SportASIN:B07K3JM3GZItem model number:VHSFBSLPW13637Department:MenManufacturer:Van Heusen SportItem Weight:260 gGeneric Name:Formal Shirt,Care Instructions: Machine WashFit Type: slim fitColour: Blue With WhiteMaterial: cottonSlim fitLong sleeveMachine wash
IndoPrimo Men's Slim Fit Casual Shirt  ,3.8 out of 5 stars,699,"₹699₹1,999",https://www.amazon.in//IndoPrimo-Cotton-Casual-Stylish-Sleeve/dp/B08R21T75D/ref=sr_1_5?dchild=1&keywords=shirts&qid=1620302108&s=computers&sr=1-5-catcorr,"Shop from a wide range of Casual Shirt from IndoPrimo . Perfect for your everyday use, you could pair it with a stylish pair of Jeans or Trousers complete the look.",Is Discontinued By Manufacturer:NoPackage Dimensions:26.7 x 23.8 x 6 cm; 280 GramsDate First Available:31 August 2018Manufacturer:IndoPrimoASIN:B08R21DKPCItem part number:Men's Stylish Casual Shirt LizaDepartment:MenManufacturer:IndoPrimoItem Weight:280 gNet Quantity:1.00 Unit,"Care Instructions: Hand Wash OnlyFit Type: Regular Fit100% High-grade Cotton Fabrics: Good capability of tenderness, air permeability and moisture absorption feels soft and comfy.Suitable for: Sports, Casual, Business Work, Date, Party, Perfect gift for families, friends and boyfriendSlim Fit , Fabric: 100% Cotton , Full Sleeve ,Casual ShirtsHigh Quality Fabric and StitchingWash Instruction: Handwash / Machine wash| Low iron and tumble dry on low heat"
Amazon Brand - Inkast Denim Co. Men's Slim Fit Casual Shirt  ,3.9 out of 5 stars,709,"₹709₹2,199",https://www.amazon.in//Amazon-Brand-Inkast-S-33A_Ice-Blue_Medium/dp/B07GSH83Y6/ref=sr_1_18?dchild=1&keywords=shirts&qid=1620302108&s=computers&sr=1-18-catcorr,"INKAST 100% Cotton Indigo casual shirt. Apt for casual outings, this shirt keeps you comfortble and stylish all day long.",Package Dimensions:46.2 x 29.6 x 4.1 cm; 350 GramsDate First Available:23 August 2018Manufacturer:Inkast Denim Co.ASIN:B07GSH83Y6Item model number:IN-S-33ADepartment:MenManufacturer:Inkast Denim Co.Item Weight:350 gGeneric Name:Casual Shirt,"Care Instructions: Machine WashFit Type: Slim FitMaterial - 100% CottonSlim fit and Full sleeve shirtCollar style - Button down collar; Cuff style - Single cuffPattern - Solid Men’s Casual ShirtIndigo dyed ice washed shirt with button down collar & stylised chest pocketMachine wash warm, wash dark colors separately, do not bleach, tumble dry low, warm Iron"
"Purabelle Unisex Shirt Tucker Stays Lock Belt Strap Adjustable Elastic Wrinkle-Free Non-Garters Stay Clamps holder Keeps (Black,Free Size)  ",4.1 out of 5 stars,349,₹349₹499,https://www.amazon.in//Purabelle-Adjustable-Elastic-Wrinkle-Free-Non-Garters/dp/B08WLVZ2FH/ref=sr_1_13?dchild=1&keywords=shirts&qid=1620302108&s=computers&sr=1-13-catcorr,"Purabelle Adjustable | Non-Slip | Locking Clamps |Invisible Elastic Shirt Stays Tucker Garter Belt for Men And Women (Black)  No one likes a half-undone shirt, it looks sloppy and unprofessional, and constantly tucking it back in is even more embarrassing. It uses a revolutionary design and functionality in order to enhance your aesthetic and professional appearance. Comfortable enough for daily wear. You know the classic saying: You never get a second chance to make a first impression. Our Shirt Stays -Belt Style widely used for Military，Police，Lawyer，Business person， Waiter and so on. Fit for men and women waist!!    Features:  It is designed to keep your shirt tucked in to be worn daily and withstand washing. The shirt stays are made with a durable elastic strap, an adjustable buckle, and metal clip with nylon teeth. The adjustable buckle ensures that once adjusted it will not readjust. The metal clip firmly grips on to your shirt and socks to keep your shirt tucked in and looking good. Metal clasps with nylon teeth firmly grip your shirts all day without damaging them.  HOW TO USE?: Step 1: Slide last shirt button into the metal clip. Step 2:Wrap tucker around waist and fasten， adjust the size to fit accordingly. Step 3:Put on your pants, keeps your body a more slim appearance.  ",Package Dimensions:17 x 10 x 6 cm; 200 GramsDate First Available:15 February 2021Manufacturer:PurabelleASIN:B08WLVZ2FHItem part number:PB-STB01Country of Origin:IndiaManufacturer:PurabelleItem Weight:200 gNet Quantity:1.00 countGeneric Name:Shirt Tucker,"The adjustable shirt holders are suitable for people usually need to wear shirt, both men and women, or for people have to interview, give a speech, go to the wedding, work, attend official occasions, and so onThe shirt lock belt is easy to use, the buckle slot is convenient for you to tie the belt, can keep the shirt tucked in tightly, keep it flat and neat, make you look charmingThe elastic shirt belts are made of spandex and the hook is made of nylon, durable to use, they are elastic, will not make your shirt slip out, lightweight to wear, will not give you burden, can resist to sweat, abrasion, meet your need in neat appearanceYou will get 1 pieces shirt stay lock belts, enough quantity for you to wear for daily life, suitable for your various shirtsCare Instructions: Dry Clean Only"
"Allen Solly Men's Plain Slim Fit Casual Shirt  ₹790₹790 ₹1,399₹1,399 ",3.6 out of 5 stars,790,"₹790₹1,399",https://www.amazon.in//Allen-Solly-Plain-Casual-ASSFWMOFB12720_Grey_42/dp/B07DMX4XHP/ref=sr_1_7?dchild=1&keywords=shirts&qid=1620302108&s=computers&sr=1-7-catcorr,Allen solly Mens Cotton Full sleeve Overdyed shirts with contrast logo,"Product Dimensions:15 x 15 x 3 cm; 450 GramsDate First Available:9 June 2018Manufacturer:Aditya Birla Fashion and Retail LimitedASIN:B07DMYF77CItem model number:ASSFWMOFT40543Department:MenManufacturer:Aditya Birla Fashion and Retail Limited, Aditya Birla Fashion and Retail Limited. Kh No. 118/110/1, Building 2, Divyasree Technopolis, Yemalur Post, Off HAL Airport Road, Bengaluru-560037 - Contact - 9742580560Packer:Aditya Birla Fashion and Retail Limited. Kh No. 118/110/1, Building 2, Divyasree Technopolis, Yemalur Post, Off HAL Airport Road, Bengaluru-560037 - Contact - 9742580560Importer:Aditya Birla Fashion and Retail LimitedItem Weight:450 gItem Dimensions LxWxH:15 x 15 x 3 CentimetersNet Quantity:1 UIncluded Components:1-ShirtGeneric Name:Shirt",Care Instructions: Machine WashFit Type: slim fit100% CottonSlim fitLong sleeveMachine washPlus size available from size 46/XXL onwards
EYEBOGLER Men's T-Shirt  ,3.8 out of 5 stars,430,"₹430₹1,299",https://www.amazon.in//EYEBOGLER-Solid-Regular-T-Shirt-T322_Black/dp/B08N6ZCZPF/ref=sr_1_22?dchild=1&keywords=shirts&qid=1620302108&s=computers&sr=1-22-catcorr,,"Product Dimensions:72 x 46 x 37 cm; 240 GramsDate First Available:11 November 2020Manufacturer:Seven Rocks International, Ludhiana, Punjab, 141003ASIN:B08N72HP4TItem model number:T322Department:MenManufacturer:Seven Rocks International, Ludhiana, Punjab, 141003, Seven Rocks International, Cheema Chowk, LudhianaPacker:SEVEN ROCKS INTERNATIONAL,Cheema Chownk,LudhianaImporter:SEVEN ROCKS INTERNATIONAL,Cheema Chownk,LudhianaItem Weight:240 gItem Dimensions LxWxH:72 x 46 x 37 CentimetersNet Quantity:1 PieceIncluded Components:T-ShirtGeneric Name:T-Shirt","Care Instructions: Machine WashFit Type: regular fitMoisture wicking fabric is quick-drying, ultra-soft & has a soft feel, keeping you comfortable through any athletic activity.Designed for a comfortable experience. Crew-neck provides a nonrestrictive fit; short-sleeve allows for a wider range of motionPerfect for running, workout and training sports and even as an moisture wicking undershirt.Raglan sleeves for a sporty lookFamously durable beefy-t fabric"
"Tryme Fashion Men's Regular Fit Casual Shirt  ₹699₹699 ₹1,999₹1,999 ",3.9 out of 5 stars,699,"₹699₹1,999",https://www.amazon.in//Tryme-Fashion-Cotton-Checked-Sleeves/dp/B08LH1SKFD/ref=sr_1_3?dchild=1&keywords=shirts&qid=1620302108&s=computers&sr=1-3-catcorr,"Shop from a wide range of Shirt from Tryme Fashion. Perfect for your everyday use, you could pair it with a stylish pair of Jeans or Trousers complete the look.",Is Discontinued By Manufacturer:NoPackage Dimensions:26.8 x 23.8 x 6.1 cm; 290 GramsDate First Available:24 October 2018Manufacturer:TRYme FashionASIN:B0848RMQ69Item part number:Men's Casual Shirt ChecksDepartment:MenManufacturer:TRYme FashionItem Weight:290 g,Care Instructions: Dry Clean OnlyFit Type: Regular FitWash Care: Dry Clean OnlyFabric Type: CottonPattern name: SolidClosure Type: ButtonedSleeve Type: Long Sleeve; Collar Style: Classic
Dennis Lingo Men's Solid Slim Fit Casual Shirt  ,3.9 out of 5 stars,712,"₹712₹2,499",https://www.amazon.in//Dennis-Lingo-Casual-AZ502_DARKBLUE_L_Dark-Blue_L/dp/B0787QSG89/ref=sr_1_12?dchild=1&keywords=shirts&qid=1620302108&s=computers&sr=1-12-catcorr,"Product Details:This Blue Denim Casual shirt has a spread collar, A full button Placket, Long Sleeves, Yoke on the shoulder, and a curved hemlineSize and FitSlim FitThe Model (height 6 foot and shoulders 18 inches is wearing size 40/LPlease check the size chart for more details before orderingMaterial & Care100% Premium Cotton (Machine Wash Warm)Style TipEnhance your look by wearing this trendy shirt. Team it with a pair of blue denims and white sneakers for a fun Saturday night with friendsStill Confused don’t be, we offer 30 day Return Policy with full refunds(No questions asked)About the Brand DENNIS LINGOFinding Basic premium Essential wear should not be a task, that’s why we started Dennis Lingo, to create a one stop shop for premium essential clothing for everyday use at rock bottom prices","Is Discontinued By Manufacturer:NoProduct Dimensions:30 x 24 x 1 cm; 200 GramsDate First Available:10 June 2018Manufacturer:Swastik CreationASIN:B0787S1HTDItem model number:AZ502_DARKBLUE_SDepartment:MenManufacturer:Swastik Creation, Swastik Creation -B-21, Bharat Ind. Estate, Sewree (w) ,Mumbai-15, Email - dennislingoshirts@gmail.com, Phone No. 022-22010742Packer:Swastik Creation -B-21, Bharat Ind. Estate, Sewree (w) ,Mumbai-15, Email - dennislingoshirts@gmail.com, Phone No. 022-22010742Item Weight:200 gItem Dimensions LxWxH:30 x 24 x 1 CentimetersNet Quantity:1 NumbersIncluded Components:Casual ShirtGeneric Name:Casual Shirt","Care Instructions: Machine WashFit Type: slim fit100% premium denim Cottton, pre washed for an extremely soft finish and rich lookStylish full sleeve casual shirtModern slim fit ( we have updated our size chart, please refer the size chart for new measurements before ordering)Best for casual & smart casual wearSize chart - s-38, m-40, cold-42, xl-44, xxxl-46"
"My Fabric Store Men's Cotton-Blend Shirt & Poly Viscose Pant Unstitched Executive Fabric Combo Set with Gift Box(Blue-01 : Blue,Shirt 2.2 Meters Pant 1.2 Meters)  ",3.5 out of 5 stars,549,"₹549₹1,099",https://www.amazon.in//My-Fabric-Store-Unstitched-Trouser/dp/B0100RDGUI/ref=sr_1_21?dchild=1&keywords=shirts&qid=1620302108&s=computers&sr=1-21-catcorr,"Package Contents: 1 Shirt Fabric and 1 Trouser Fabric with Gift Box. About the Fabric MyFabricStore Executive Shirt and Trouser Fabric Combo for Men - Stylish and Sophisticated. Trouser is made of high quality poly viscose suiting fabric and features a Solid Self Design. Shirt fabric is made of High Quality Blended Cotton and its very lightweight and comfortable. A Versatile PV and Cotton Rich fabric makes it a perfect choice for Power Dressing. Good for all Seasons - Summer Wear, Spring, Winter Wear or Autumn.  Features: The Perfect Look: A great style and perfect fit are instrumental for good dressing! Look cool and smart, feel comfortable and make the right impression with this premium shirt and trouser fabric from My Fabric Store.  Gifting: This Fabric will make a perfect gift for Weddings, Anniversary, or Birthdays. Now don't be confused on what to gift your Son, Father, Father in law, Son in law, Grooms on special occasion and choose this well crafted fabric to leave last longing impression.  Occasion: This Premium Shirt and Pant fabric will make great for a Business Meeting, Formal Wear, Semi-Formal Wear, Evening or Any Casual Events. Fitting:Fits perfectly after stitching and even after many washes. Unique Gifts Idea: Perfect for Birthdays, Marriages, Husbands, Groom, Father, Brother and all your loved ones.  About the brandwith season focused offerings that blend in both key fashion inputs dictated by International trends and the highest quality standards MyFabricStore is trending Fabric brand on Amazon. We are Pioneers in Selling Fabrics Online.   Fresh new designs, trusted quality at everyday Best prices. Please Check out New Arrivals and our Complete collection of Men Fabrics on Amazon by Clicking on ""MyFabricStore""  Made in India",Is Discontinued By Manufacturer:NoPackage Dimensions:21.3 x 16.8 x 4.3 cm; 510 GramsDate First Available:19 June 2015Manufacturer:My Fabric StoreASIN:B0100RDGUIItem part number:GWL_NAK_STR_COMBO_3Country of Origin:IndiaDepartment:MenManufacturer:My Fabric StoreItem Weight:510 g,"Fine And Elegant Pre-Matched Shirt And Trouser Fabric. Soft And Comfortable For All Day DressingIdeal For Personal Use As Well As Gifting In Marriage, Festival And Other Occasions. Perfect For Special Occasions, Formal Or Semi-Casual LookCollection Of Shirt And Trouser Combo Set. Comes In Gift Box."
"Dennis Lingo Men's Shirt  ₹699₹699 ₹2,499₹2,499 ",3.9 out of 5 stars,699,"₹699₹2,499",https://www.amazon.in//Dennis-Lingo-Checkered-D-Blue-AZ751_D-Blue_M/dp/B08YNWZ2VQ/ref=sr_1_17?dchild=1&keywords=shirts&qid=1620302108&s=computers&sr=1-17-catcorr,"Product Details:This Casual Checkered shirt has a Slim Collar, Full Sleeves and a curved hemlineSize and FitSlim FitThe Model (height 6 foot and shoulders 18 inches is wearing size 40/MPlease check the size chart for more details before orderingMaterial & Care100% Premium Cotton (Machine Wash Regular)Style TipEnhance your look by wearing this Casual Stylish Men's shirt, Team it with a pair of rugged tapered denims/Or Solid Chinos and White Sneakers for a fun Casual Casual lookAbout the Brand DENNIS LINGOFinding Basic Menswear for daily use can be hard among todays Fast fashion world, where trends change daily. That’s why we started Dennis Lingo, to create a one stop shop for premium essential clothing for everyday use at lowest prices","Product Dimensions:30 x 24 x 1 cm; 200 GramsDate First Available:25 May 2018Manufacturer:Swastik CreationASIN:B07D9SQ4XCItem model number:C415_MUSTARD_SDepartment:MenManufacturer:Swastik Creation, Swastik Creation -B-21, Bharat Ind. Estate, Sewree (w) ,Mumbai-15, Email - dennislingoshirts@gmail.com, Phone No. 022-22010742Item Weight:200 gItem Dimensions LxWxH:30 x 24 x 1 CentimetersNet Quantity:1 NIncluded Components:Casual ShirtGeneric Name:Shirt","Care Instructions: Machine WashFit Type: slim fit100% premium Cotton, pre washed for an extremely soft finish and rich lookStylish full sleeve checkered casual shirtModern slim fit ( we have updated our size chart, please refer the size chart for new measurements before ordering)There might be minor color variation between actual product and image shown on screen due to lighting on the photography, Best for casual & smart casual wearSize chart - s-38, m-40, l-42, xl-44, xxl-46Country of Origin: India"
"Arihant GHPC Checkered Cotton Regular Fit Formal Shirt for Men  ₹699₹699 ₹1,799₹1,799 ",4.1 out of 5 stars,699,"₹699₹1,799",https://www.amazon.in//Arihant-Checkered-Sleeves-Regular-AX819602_42/dp/B08MWHLXJS/ref=sr_1_11?dchild=1&keywords=shirts&qid=1620302108&s=computers&sr=1-11-catcorr,"Brand Name :- ArihantManufacturer :- Geo Commerce Pvt. Ltd. Product Description : A Well Designed 100% Cotton Formal Shirt With Structured Cuts And Regular Fitting, Half Sleeves And Classic Collar With A Pointed Patch Pocket On Chest. Don This Shirt With A Pair Of Well Fitted Pants And You Are All Set To Make An Impression. Note :- Product Colour May Slightly Vary Due To Photographic Lighting Sources Or Your Monitor Settings",Package Dimensions:58.8 x 36.5 x 7 cm; 40 GramsDate First Available:27 November 2020Manufacturer:Geo Commerce Pvt. Ltd.ASIN:B08MWGZ6BSItem part number:AX81960138Department:MenManufacturer:Geo Commerce Pvt. Ltd.Item Weight:40 gGeneric Name:Formal Shirt,"Care Instructions: Machine WashFit Type: Regular FitOccasion :- Formal, Office & Business Wear; Fabric :- CottonColor :- Black; Sleeve Type :- Half SleevesCollar Style :- Classic Collar; Pocket Detail :- Patch Pocket On ChestStyle Name :- Checkered; Package Content :- 1 Formal Shirt For MenCare Instructions :- Machine Wash Warm, Wash Dark Colours Separately, Do Not Bleach, Tumble Dry Low, Warm Iron."
Diverse Men's Regular Formal Shirt  ,4.0 out of 5 stars,499,"₹499₹1,199",https://www.amazon.in//gp/bestsellers/apparel/1968096031/ref=sr_bs_0_1968096031_1,,,
Dennis Lingo Men's Solid Slim Fit Casual Shirt  ,3.9 out of 5 stars,522,"₹522₹1,849",https://www.amazon.in//gp/bestsellers/apparel/1968094031/ref=sr_bs_7_1968094031_1,,,
"Dennis Lingo Men's Slim Fit Shirt  ₹522₹522 ₹1,849₹1,849 ",3.8 out of 5 stars,522,"₹522₹1,849",https://www.amazon.in//Dennis-Lingo-Casual-C301_SkyBlue_L_Sky-Blue_L/dp/B079S5GVRK/ref=sr_1_6?dchild=1&keywords=shirts&qid=1620302108&s=computers&sr=1-6-catcorr,"Product Details:This Casual Solid shirt has a Slim Collar ,Long Sleeves and a curved hemlineSize and FitSlim FitThe Model (height 6 foot and shoulders 18 inches is wearing size 40/MPlease check the size chart for more details before orderingMaterial & Care100% Premium Cotton (Machine Wash Regular)Style TipEnhance your look by wearing this Casual Stylish Men's shirt, Team it with a pair of tapered denimsOr Solid Chinos and Loafers for a fun Smart Casual look.About the Brand DENNIS LINGOFinding Basic Menswear for daily use can be hard among todays Fast fashion world, where trends change daily. That’s why we started Dennis Lingo, to create a one stop shop for premium essential clothing for everyday use at lowest prices","Product Dimensions:30 x 24 x 1 cm; 200 GramsDate First Available:2 August 2019Manufacturer:Swastik CreationASIN:B07VWWD67LItem model number:C301_B-GREEN_MDepartment:MenManufacturer:Swastik Creation, Swastik Creation -B-21, Bharat Ind. Estate, Sewree (w) ,Mumbai-15, Email - dennislingoshirts@gmail.com, Phone No. 022-22010742Packer:Swastik Creation -B-21, Bharat Ind. Estate, Sewree (w) ,Mumbai-15, Email - dennislingoshirts@gmail.com, Phone No. 022-22010742Item Weight:200 gItem Dimensions LxWxH:30 x 24 x 1 CentimetersNet Quantity:1 NumbersIncluded Components:Casual ShirtGeneric Name:Casual Shirt",Care Instructions: Machine WashFit Type: slim fitColor Name: Bottle Green100% CottonLong sleeveSlim fitMachine wash
Amazon Brand - Symbol Men's Regular Fit Shirt  ,4.1 out of 5 stars,429,"₹429₹1,199",https://www.amazon.in//Amazon-Brand-Symbol-Regular-SS20-SYM-FS-01_EPP-1A_White/dp/B081QJRMW9/ref=sr_1_20?dchild=1&keywords=shirts&qid=1620302108&s=computers&sr=1-20-catcorr,An Amazon Brand - Symbol is a western wear brand of everyday basics for men and women. It offers great fits and quality fabrics made affordable and accessible. Our products encapsulate the values of simplicity and longevity. Made with such care and craftsmanship.,Package Dimensions:22.8 x 21.9 x 6.8 cm; 290 GramsDate First Available:19 November 2019Manufacturer:Amazon Brand - SymbolASIN:B081QK31TZItem model number:SS20-SYM-FS-01_EPP-1ADepartment:MenManufacturer:Amazon Brand - SymbolItem Weight:290 gGeneric Name:Shirt,Care Instructions: Machine WashFit Type: Regular Fit100% Cotton fabricSemi cut-away collarChiselled cuffCut & sew front placketMade in IndiaMachine wash
