title,rating,offer_price,origional_price,url,description,des,dis2
Leriya Fashion Offers All Kinds of Tops for Both Women and Girls - Tops for Women  ,3.5 out of 5 stars,349,"₹349₹1,999",https://www.amazon.in//Leriya-Fashion-Womens-Sleeves-36-inch/dp/B07MZ4GNGD/ref=sr_1_19?dchild=1&keywords=shirts&qid=1620302108&s=computers&sr=1-19-catcorr,"Crisp white Slab Cotton shirt, has a mandarin collar, three-quarter bell sleeves with tie-up detail, concealed full button placket, straight hem. This product is made of Synthetic, Crape. Available in size :- S, M, L and XL. Ideal for daily, casual, party/evening, office/work wear, or semi formal occasion . Very nice and comfortable smart western wear clothes for women designed in line with the best international trends.Latest fashion that looks great and stylish on girls and would make an amazing gift. Note - the colour might appear slightly different due to changes in your screen resolution.","Product Dimensions:12 x 12 x 2 cm; 249 GramsDate First Available:19 November 2019Manufacturer:Leriya FashionASIN:B085HWRC3HItem model number:LF-W1223-SDepartment:WomenManufacturer:Leriya Fashion, Leriya FashionItem Weight:249 gItem Dimensions LxWxH:12 x 12 x 2 CentimetersNet Quantity:1.00 countGeneric Name:Top",Care Instructions: Dry Clean OnlyFit Type: regular fitColor Name: BlackMaterial: RayonDry clean onlyTunicThree Quarter sleeveRound neck
Campus Sutra Checkered Cotton Casual Shirts -Ideal for Men  ,3.6 out of 5 stars,595,"₹595₹1,499",https://www.amazon.in//Campus-Sutra-Checkered-Regular-AZ17SHRT_BGCHK1_M_PLN_DNBU_AZ_Denim/dp/B071NTZXPB/ref=sr_1_24?dchild=1&keywords=shirts&qid=1620302108&s=computers&sr=1-24-catcorr,Wear this spread collar solid shirts from the house of campus sutra. We suggest teaming it with a pair of jeans and casual shoes for a great look.,"Is Discontinued By Manufacturer:NoProduct Dimensions:26 x 22 x 1.5 cm; 350 GramsDate First Available:9 May 2017Manufacturer:Campus SutraASIN:B07283PVYPItem model number:AZ17SHRT_BGCHK1_M_PLN_DNBU_AZ_SDepartment:MenManufacturer:Campus Sutra, Campus Sutra Retail private limited,2nd floor, 117/A,5th main road,yeshwanthpur,Bengaluru 560022Packer:Campus Sutra Retail private limited,2nd floor, 117/A,5th main road,yeshwanthpur,Bengaluru 560022Importer:Campus Sutra Retail private limited,2nd floor, 117/A,5th main road,yeshwanthpur,Bengaluru 560022Item Weight:350 gItem Dimensions LxWxH:26 x 22 x 1.5 CentimetersNet Quantity:1 NumbersIncluded Components:1 ShirtGeneric Name:Casual Shirt","Care Instructions: Machine WashFit Type: regular fitStyle: CheckeredClosure:Button, Classic fit with comfortCollar:Polo ,Sleeve :Full SleeveOccasion: Casual; fabric :Pure CottonWash separately, mild detergent and dry inside out"
"EYEBOGLER Men's Solid Regular Fit T-Shirt  ₹380₹380 ₹1,299₹1,299 ",3.8 out of 5 stars,380,"₹380₹1,299",https://www.amazon.in//Seven-Rocks-Regular-T-Shirt-XL-T15-NB/dp/B07C973VJ3/ref=sr_1_15?dchild=1&keywords=shirts&qid=1620302108&s=computers&sr=1-15-catcorr,,"Product Dimensions:70 x 41 x 35 cm; 240 GramsDate First Available:11 November 2020Manufacturer:Seven Rocks International, Ludhiana, Punjab, 141003ASIN:B08N74GXJBItem model number:T15Department:MenManufacturer:Seven Rocks International, Ludhiana, Punjab, 141003, Seven Rocks International, Cheema Chowk, LudhianaPacker:SEVEN ROCKS INTERNATIONAL,Cheema Chownk,LudhianaImporter:SEVEN ROCKS INTERNATIONAL,Cheema Chownk,LudhianaItem Weight:240 gItem Dimensions LxWxH:70 x 41 x 35 CentimetersNet Quantity:1 PieceIncluded Components:T-ShirtGeneric Name:T-Shirt","Care Instructions: Machine WashFit Type: regular fitMoisture wicking fabric is quick-drying, ultra-soft & has a soft feel, keeping you comfortable through any athletic activity.Designed for a comfortable experience. Crew-neck provides a nonrestrictive fit; short-sleeve allows for a wider range of motionPerfect for running, workout and training sports and even as an moisture wicking undershirt.Raglan sleeves for a sporty lookFamously durable beefy-t fabric"
"VIBRAT Unisex Shirt Tucker Stays Lock Belt Strap Adjustable Elastic Wrinkle-Free Non-Garters Stay Clamps holder Keeps (Black, Large)  ",4.1 out of 5 stars,379,"₹379₹1,199",https://www.amazon.in//VIBRAT-Adjustable-Elastic-Holder-Military/dp/B082WXRCHD/ref=sr_1_14?dchild=1&keywords=shirts&qid=1620302108&s=computers&sr=1-14-catcorr,,Package Dimensions:16.4 x 6.1 x 2.6 cm; 50 GramsDate First Available:18 December 2019ASIN:B082WXRCHDItem part number:shirt_stay_beltCountry of Origin:IndiaDepartment:UnisexItem Weight:50 g,"High Quality Material: The belt-style shirt stay is made of hook and loop material with 10x the tensile strength of velcro, uses a revolutionary design and functionality in order to enhance your aesthetic and professional appearanceEasy to Use: The belt-style shirt stay is the easiest shirt stay you'll ever use, and takes only a few seconds to put on each morning.The rubber grips and a button slot guarantee your shirt to stay tucked, keeping it low and close to the body.You'll quickly forget you are even wearing itShirt Stays Sizeï¼?2.50CMx120CM( 1inch x 47.2inch) Adjustable, Maximum stretch 150cm or 59in. One size fit all most!"
"Raymond fabric Makers Men's Cotton Unstitched 2.4 m Shirt and Trouser Fabric Combo (Multicolour, Free Size)  ",3.6 out of 5 stars,799,₹799₹999,https://www.amazon.in//gp/bestsellers/apparel/15330070031/ref=sr_bs_8_15330070031_1,,,
"Siyaram's Men's Unstitched 2.25 m Trouser and Shirt Fabric Combo (Multicolour, Free Size)  ",3.8 out of 5 stars,552,₹552,https://www.amazon.in//Siyarams-Unstitched-Trouser-Fabric-Multicolour_2-25m/dp/B01MRY9SNX/ref=sr_1_16?dchild=1&keywords=shirts&qid=1620302108&s=computers&sr=1-16-catcorr,"Features : Fresh Fabric: Pant Self or plain/ Shirt Check or Line, Pant/Shirt Blend: P/V 65/35, C/P 20/80, Net Quantity: Pant (1No.), Shirt (1No.), Length: 1.20 m. (Pant), 2.25 m. (Shirt), Width: 1.47 m, 90 cm, Colour Family: Multi Design. Lifestyle Casual/Gift Purpose Wash Care Hand Wash Each combo pack consists of different colour and design from the picture of combo.",Is Discontinued By Manufacturer:NoPackage Dimensions:15 x 5 x 5 cm; 100 GramsDate First Available:14 December 2016Manufacturer:Siyaram'sASIN:B01MRY9SNXItem part number:FVB-CO617Department:Unisex-adultManufacturer:Siyaram'sItem Weight:100 g,"Care Instructions: Hand Wash OnlyFit Type: Regular FitPant Self or plain/ Shirt Check or Line1.20 mts. (Pant), 2.25mts. (Shirt)Pant Self or plain/ Shirt Check or Line (Combo)Hand Wash"
,,,,https://www.amazon.in/#s-skipLinkTargetForMainSearchResults,,,
